9411 - 2016,17/05/2016,1 - CONVITE,225,COMETA DISTRIBUIDORA DE PECAS E SERVICOS LTDA - ME,1885,aquisição de um compressor de gás R-22 e prestação de serviço de troca de compressor e reparo em dois condicionadores de ar no Teatro Rondon Pacheco em atendimento as Secretarias Municipais de Governo e Cultura.,Secretaria Municipal de Governo,Qual o valor gasto com aquisição de um compressor de gás R-22 e prestação de serviço de troca de compressor e reparo em dois condicionadores de ar no Teatro Rondon Pacheco em atendimento as Secretarias Municipais de Governo e Cultura.,,,,,,Prefeitura Municipal de Uberlândia
30463 - 2014,1/12/2015,5 - PREGÃO PRESENCIAL,1010,OPCAO PAPEIS COMERCIO LTDA - ME,366.16,"futuro ou e eventual fornecimento de materiais de escritório (agenda, almofada para carimbo, apontador de lapis, caneta etc), em atendimento ás Secretarias e aos Órgãos da Administração Direta da Prefeitura Municipal de Uberlândia.",Secretaria Municipal de Habitação,"Qual o valor gasto com futuro ou e eventual fornecimento de materiais de escritório (agenda, almofada para carimbo, apontador de lapis, caneta etc), em atendimento ás Secretarias e aos Órgãos da Administração Direta da Prefeitura Municipal de Uberlândia.",,,,,,Prefeitura Municipal de Uberlândia
30463 - 2014,1/12/2015,5 - PREGÃO PRESENCIAL,1010,COMERCIAL GRANADA MATERIAIS DE ESCRITORIO LTDA - EPP,57.75,"futuro ou e eventual fornecimento de materiais de escritório (agenda, almofada para carimbo, apontador de lapis, caneta etc), em atendimento ás Secretarias e aos Órgãos da Administração Direta da Prefeitura Municipal de Uberlândia.",Secretaria Municipal de Habitação,"Qual o valor gasto com futuro ou e eventual fornecimento de materiais de escritório (agenda, almofada para carimbo, apontador de lapis, caneta etc), em atendimento ás Secretarias e aos Órgãos da Administração Direta da Prefeitura Municipal de Uberlândia.",,,,,,Prefeitura Municipal de Uberlândia
30463 - 2014,1/12/2015,5 - PREGÃO PRESENCIAL,1010,MIDIAPEL PAPELARIA E INFORMATICA LTDA - ME,160,"futuro ou e eventual fornecimento de materiais de escritório (agenda, almofada para carimbo, apontador de lapis, caneta etc), em atendimento ás Secretarias e aos Órgãos da Administração Direta da Prefeitura Municipal de Uberlândia.",Secretaria Municipal de Habitação,"Qual o valor gasto com futuro ou e eventual fornecimento de materiais de escritório (agenda, almofada para carimbo, apontador de lapis, caneta etc), em atendimento ás Secretarias e aos Órgãos da Administração Direta da Prefeitura Municipal de Uberlândia.",,,,,,Prefeitura Municipal de Uberlândia
20182 - 2015,3/2/2016,2 - TOMADA DE PREÇO,459,ADA LUISA VIEIRA RODRIGUES - ME,30240,"execução do trabalho técnico social (TTS) com 64 (sessenta e quatro) famílias do Residencial Baltimore, no bairro Chácaras Tubalina, do programa "" Minha Casa Minha Vida"", em atendimento a Secretatia Municipal de Habitação.",Secretaria Municipal de Habitação,"Qual o valor gasto com execução do trabalho técnico social (TTS) com 64 (sessenta e quatro) famílias do Residencial Baltimore, no bairro Chácaras Tubalina, do programa "" Minha Casa Minha Vida"", em atendimento a Secretatia Municipal de Habitação.",,,,,,Prefeitura Municipal de Uberlândia
25312 - 2015,11/5/2016,6 - Pregão eletrônico,676,COOPERATIVA DE TRABALHO E TRANSPORTE DE UBERLANDIA LTDA - CO,146580,"prestação de serviços de transporte automotivo a ser utilizado pela Secretaria Municipal de Habitação, nas vistas aos empreendimentos e visitas domiciliares sendo 06 veículos categoria passeio.",Secretaria Municipal de Habitação,"Qual o valor gasto com prestação de serviços de transporte automotivo a ser utilizado pela Secretaria Municipal de Habitação, nas vistas aos empreendimentos e visitas domiciliares sendo 06 veículos categoria passeio.",,,,,,Prefeitura Municipal de Uberlândia
25343 - 2015,17/05/2016,5 - PREGÃO PRESENCIAL,677,LATICINIO TAQUARI LTDA,1040,"futura ou eventual aquisição de leite e manteiga, em atendimento às Secretarias e aos Órgãos da Administração Direta da Prefeitura Municipal de Uberlândia.",Secretaria Municipal de Habitação,"Qual o valor gasto com futura ou eventual aquisição de leite e manteiga, em atendimento às Secretarias e aos Órgãos da Administração Direta da Prefeitura Municipal de Uberlândia.",,,,,,Prefeitura Municipal de Uberlândia
3616 - 2016,14/03/2016,1 - CONVITE,100,M2 SOM E LUZ LTDA - ME,7200,"locação de equipamentos de filmagem, transmissão ao vivo e a gravação de evento em DVD, em atendimento a Secretaria Municipal de Habitação.",Secretaria Municipal de Habitação,"Qual o valor gasto com locação de equipamentos de filmagem, transmissão ao vivo e a gravação de evento em DVD, em atendimento a Secretaria Municipal de Habitação.",,,,,,Prefeitura Municipal de Uberlândia
29106 - 2014,19/03/2015,5 - PREGÃO PRESENCIAL,963,CAPITAL SEGURANCA CONTRA INCENDIO UBERLANDIA LTDA - ME,1805.87,"fornecimento de recargas, testes hidrostáticos, pesagens e substituião de peças em estintores de incêndio, em atendimento às Secretarias e aos Órgãos da Administração Direta da Prefeitura Municipal de Uberlândia.",Secretaria Municipal de Meio Ambiente,"Qual o valor gasto com fornecimento de recargas, testes hidrostáticos, pesagens e substituião de peças em estintores de incêndio, em atendimento às Secretarias e aos Órgãos da Administração Direta da Prefeitura Municipal de Uberlândia.",,,,,,Prefeitura Municipal de Uberlândia
30463 - 2014,1/12/2015,5 - PREGÃO PRESENCIAL,1010,MIDIAPEL PAPELARIA E INFORMATICA LTDA - ME,32,"futuro ou e eventual fornecimento de materiais de escritório (agenda, almofada para carimbo, apontador de lapis, caneta etc), em atendimento ás Secretarias e aos Órgãos da Administração Direta da Prefeitura Municipal de Uberlândia.",Secretaria Municipal de Meio Ambiente,"Qual o valor gasto com futuro ou e eventual fornecimento de materiais de escritório (agenda, almofada para carimbo, apontador de lapis, caneta etc), em atendimento ás Secretarias e aos Órgãos da Administração Direta da Prefeitura Municipal de Uberlândia.",,,,,,Prefeitura Municipal de Uberlândia
30463 - 2014,1/12/2015,5 - PREGÃO PRESENCIAL,1010,OPCAO PAPEIS COMERCIO LTDA - ME,226.8,"futuro ou e eventual fornecimento de materiais de escritório (agenda, almofada para carimbo, apontador de lapis, caneta etc), em atendimento ás Secretarias e aos Órgãos da Administração Direta da Prefeitura Municipal de Uberlândia.",Secretaria Municipal de Meio Ambiente,"Qual o valor gasto com futuro ou e eventual fornecimento de materiais de escritório (agenda, almofada para carimbo, apontador de lapis, caneta etc), em atendimento ás Secretarias e aos Órgãos da Administração Direta da Prefeitura Municipal de Uberlândia.",,,,,,Prefeitura Municipal de Uberlândia
30463 - 2014,1/12/2015,5 - PREGÃO PRESENCIAL,1010,ME COMERCIAL EIRELI,34.34,"futuro ou e eventual fornecimento de materiais de escritório (agenda, almofada para carimbo, apontador de lapis, caneta etc), em atendimento ás Secretarias e aos Órgãos da Administração Direta da Prefeitura Municipal de Uberlândia.",Secretaria Municipal de Meio Ambiente,"Qual o valor gasto com futuro ou e eventual fornecimento de materiais de escritório (agenda, almofada para carimbo, apontador de lapis, caneta etc), em atendimento ás Secretarias e aos Órgãos da Administração Direta da Prefeitura Municipal de Uberlândia.",,,,,,Prefeitura Municipal de Uberlândia
25343 - 2015,17/05/2016,5 - PREGÃO PRESENCIAL,677,LATICINIO TAQUARI LTDA,11107.2,"futura ou eventual aquisição de leite e manteiga, em atendimento às Secretarias e aos Órgãos da Administração Direta da Prefeitura Municipal de Uberlândia.",Secretaria Municipal de Meio Ambiente,"Qual o valor gasto com futura ou eventual aquisição de leite e manteiga, em atendimento às Secretarias e aos Órgãos da Administração Direta da Prefeitura Municipal de Uberlândia.",,,,,,Prefeitura Municipal de Uberlândia
31506 - 2015,24/05/2016,1 - CONVITE,977,HELCIO DE OLIVEIRA JUNIOR,65200,"elaboração do Projeto Complementar Hidrossanitário, necessário para a execução de Reforma e Ampliação do Zoológico Municipal de Uberlândia/MG, em atendimento à Secretaria Municipal de Meio Ambiente.",Secretaria Municipal de Meio Ambiente,"Qual o valor gasto com elaboração do Projeto Complementar Hidrossanitário, necessário para a execução de Reforma e Ampliação do Zoológico Municipal de Uberlândia/MG, em atendimento à Secretaria Municipal de Meio Ambiente.",,,,,,Prefeitura Municipal de Uberlândia
11853 - 2016,11/10/2016,6 - Pregão eletrônico,284,"SALI COMERCIO, LOCACAO E SERVICOS LTDA - EPP",32000,"aquisição de receptor GPS L1/L2, em atendimento à Secretaria Municipal de Meio Ambiente.",Secretaria Municipal de Meio Ambiente,"Qual o valor gasto com aquisição de receptor GPS L1/L2, em atendimento à Secretaria Municipal de Meio Ambiente.",,,,,,Prefeitura Municipal de Uberlândia
15648 - 2016,13/07/2016,1 - CONVITE,384,KI LIMPO DO BRASIL LTDA - EPP,2036,"aquisição de detergente gelatinoso concentrado (50 litros) e hipoclorito de sódio (50 litros), para a limpeza dos recintos do zoológico municipal, em antendimento a Secretaria de Meio Ambiente.",Secretaria Municipal de Meio Ambiente,"Qual o valor gasto com aquisição de detergente gelatinoso concentrado (50 litros) e hipoclorito de sódio (50 litros), para a limpeza dos recintos do zoológico municipal, em antendimento a Secretaria de Meio Ambiente.",,,,,,Prefeitura Municipal de Uberlândia
15758 - 2016,9/12/2016,6 - Pregão eletrônico,394,BARACUI COMERCIAL LTDA - ME,515,"aquisição de materiais elétricos, em atendimento às Secretarias Municipais de serviços Urbanos e Meio Ambiente.",Secretaria Municipal de Meio Ambiente,"Qual o valor gasto com aquisição de materiais elétricos, em atendimento às Secretarias Municipais de serviços Urbanos e Meio Ambiente.",,,,,,Prefeitura Municipal de Uberlândia
19399 - 2016,26/09/2016,1 - CONVITE,499,TREVISO CONSTRUTORA LTDA - EPP,74373.82,"execução do cercamento do Parque da Longevidade no bairro Jardim das Palmeiras, Loteamento São Lucas (alambrado em tela galvanizada fixada em mourão de concreto e instalação de 02 portões), em atendimento à S. Municipal de Meio Ambiente.",Secretaria Municipal de Meio Ambiente,"Qual o valor gasto com execução do cercamento do Parque da Longevidade no bairro Jardim das Palmeiras, Loteamento São Lucas (alambrado em tela galvanizada fixada em mourão de concreto e instalação de 02 portões), em atendimento à S. Municipal de Meio Ambiente.",,,,,,Prefeitura Municipal de Uberlândia
2690 - 2016,7/3/2016,1 - CONVITE,70,SISTEMAS DE ALARME MAXIMA SEGURANCA LTDA - EPP,2397.6,"contratação de empresa especializada em  monitoramento de alarme 24 horas, para os Parques Municipais Victório Siquieroli e Santa Luzia e Zoológico Municipal, em atendimento a Secretaria Municipal de Meio Ambiente.",Secretaria Municipal de Meio Ambiente,"Qual o valor gasto com contratação de empresa especializada em  monitoramento de alarme 24 horas, para os Parques Municipais Victório Siquieroli e Santa Luzia e Zoológico Municipal, em atendimento a Secretaria Municipal de Meio Ambiente.",,,,,,Prefeitura Municipal de Uberlândia
29106 - 2014,19/03/2015,5 - PREGÃO PRESENCIAL,963,CAPITAL SEGURANCA CONTRA INCENDIO UBERLANDIA LTDA - ME,1139.63,"fornecimento de recargas, testes hidrostáticos, pesagens e substituião de peças em estintores de incêndio, em atendimento às Secretarias e aos Órgãos da Administração Direta da Prefeitura Municipal de Uberlândia.",Secretaria Municipal de Obras,"Qual o valor gasto com fornecimento de recargas, testes hidrostáticos, pesagens e substituião de peças em estintores de incêndio, em atendimento às Secretarias e aos Órgãos da Administração Direta da Prefeitura Municipal de Uberlândia.",,,,,,Prefeitura Municipal de Uberlândia
30463 - 2014,1/12/2015,5 - PREGÃO PRESENCIAL,1010,OPCAO PAPEIS COMERCIO LTDA - ME,261.21,"futuro ou e eventual fornecimento de materiais de escritório (agenda, almofada para carimbo, apontador de lapis, caneta etc), em atendimento ás Secretarias e aos Órgãos da Administração Direta da Prefeitura Municipal de Uberlândia.",Secretaria Municipal de Obras,"Qual o valor gasto com futuro ou e eventual fornecimento de materiais de escritório (agenda, almofada para carimbo, apontador de lapis, caneta etc), em atendimento ás Secretarias e aos Órgãos da Administração Direta da Prefeitura Municipal de Uberlândia.",,,,,,Prefeitura Municipal de Uberlândia
30463 - 2014,1/12/2015,5 - PREGÃO PRESENCIAL,1010,COMERCIAL GRANADA MATERIAIS DE ESCRITORIO LTDA - EPP,86,"futuro ou e eventual fornecimento de materiais de escritório (agenda, almofada para carimbo, apontador de lapis, caneta etc), em atendimento ás Secretarias e aos Órgãos da Administração Direta da Prefeitura Municipal de Uberlândia.",Secretaria Municipal de Obras,"Qual o valor gasto com futuro ou e eventual fornecimento de materiais de escritório (agenda, almofada para carimbo, apontador de lapis, caneta etc), em atendimento ás Secretarias e aos Órgãos da Administração Direta da Prefeitura Municipal de Uberlândia.",,,,,,Prefeitura Municipal de Uberlândia
30463 - 2014,1/12/2015,5 - PREGÃO PRESENCIAL,1010,MIDIAPEL PAPELARIA E INFORMATICA LTDA - ME,16,"futuro ou e eventual fornecimento de materiais de escritório (agenda, almofada para carimbo, apontador de lapis, caneta etc), em atendimento ás Secretarias e aos Órgãos da Administração Direta da Prefeitura Municipal de Uberlândia.",Secretaria Municipal de Obras,"Qual o valor gasto com futuro ou e eventual fornecimento de materiais de escritório (agenda, almofada para carimbo, apontador de lapis, caneta etc), em atendimento ás Secretarias e aos Órgãos da Administração Direta da Prefeitura Municipal de Uberlândia.",,,,,,Prefeitura Municipal de Uberlândia
30463 - 2014,1/12/2015,5 - PREGÃO PRESENCIAL,1010,ME COMERCIAL EIRELI,196.26,"futuro ou e eventual fornecimento de materiais de escritório (agenda, almofada para carimbo, apontador de lapis, caneta etc), em atendimento ás Secretarias e aos Órgãos da Administração Direta da Prefeitura Municipal de Uberlândia.",Secretaria Municipal de Obras,"Qual o valor gasto com futuro ou e eventual fornecimento de materiais de escritório (agenda, almofada para carimbo, apontador de lapis, caneta etc), em atendimento ás Secretarias e aos Órgãos da Administração Direta da Prefeitura Municipal de Uberlândia.",,,,,,Prefeitura Municipal de Uberlândia
14462 - 2015,15/04/2016,6 - Pregão eletrônico,278,BARACUI COMERCIAL LTDA - ME,4067.46,"aquisição de materiais de segurança, em atendimento à Secretaria Municipal de Obras.",Secretaria Municipal de Obras,"Qual o valor gasto com aquisição de materiais de segurança, em atendimento à Secretaria Municipal de Obras.",,,,,,Prefeitura Municipal de Uberlândia
14462 - 2015,15/04/2016,6 - Pregão eletrônico,278,VDM EQUIPAMENTOS DE SEGURANCA E UNIFORMES LTDA,14124.6,"aquisição de materiais de segurança, em atendimento à Secretaria Municipal de Obras.",Secretaria Municipal de Obras,"Qual o valor gasto com aquisição de materiais de segurança, em atendimento à Secretaria Municipal de Obras.",,,,,,Prefeitura Municipal de Uberlândia
18341 - 2015,15/02/2016,6 - Pregão eletrônico,387,PLANO A COMERCIO E SERVICOS LTDA - ME,4777.5,"aquisição de equipamentos (subwoofer e amplificador para caixa acústica), em atendimento á secretaria Municipal de Obras.",Secretaria Municipal de Obras,"Qual o valor gasto com aquisição de equipamentos (subwoofer e amplificador para caixa acústica), em atendimento á secretaria Municipal de Obras.",,,,,,Prefeitura Municipal de Uberlândia
23873 - 2015,19/04/2016,6 - Pregão eletrônico,619,MADEIREIRA REI DE MINAS EIRELI - EPP,2795,"aquisição de biombo de madeira, em atendimento à Secretaria Municipal de Obras.",Secretaria Municipal de Obras,"Qual o valor gasto com aquisição de biombo de madeira, em atendimento à Secretaria Municipal de Obras.",,,,,,Prefeitura Municipal de Uberlândia
25343 - 2015,17/05/2016,5 - PREGÃO PRESENCIAL,677,LATICINIO TAQUARI LTDA,26000,"futura ou eventual aquisição de leite e manteiga, em atendimento às Secretarias e aos Órgãos da Administração Direta da Prefeitura Municipal de Uberlândia.",Secretaria Municipal de Obras,"Qual o valor gasto com futura ou eventual aquisição de leite e manteiga, em atendimento às Secretarias e aos Órgãos da Administração Direta da Prefeitura Municipal de Uberlândia.",,,,,,Prefeitura Municipal de Uberlândia
25796 - 2015,15/07/2016,6 - Pregão eletrônico,692,SEVENMIX COMERCIO E SERVICO EIRELI - ME,138775,"aquisição de materiais de construção (areia, cimento e ferro), em atendimento à Secretaria Municipal de Obras.",Secretaria Municipal de Obras,"Qual o valor gasto com aquisição de materiais de construção (areia, cimento e ferro), em atendimento à Secretaria Municipal de Obras.",,,,,,Prefeitura Municipal de Uberlândia
25796 - 2015,15/07/2016,6 - Pregão eletrônico,692,ELDORADO MATERIAIS PARA CONSTRUCAO LTDA - EPP,66418,"aquisição de materiais de construção (areia, cimento e ferro), em atendimento à Secretaria Municipal de Obras.",Secretaria Municipal de Obras,"Qual o valor gasto com aquisição de materiais de construção (areia, cimento e ferro), em atendimento à Secretaria Municipal de Obras.",,,,,,Prefeitura Municipal de Uberlândia
25796 - 2015,15/07/2016,6 - Pregão eletrônico,692,MADEIREIRA REI DE MINAS EIRELI - EPP,14466.3,"aquisição de materiais de construção (areia, cimento e ferro), em atendimento à Secretaria Municipal de Obras.",Secretaria Municipal de Obras,"Qual o valor gasto com aquisição de materiais de construção (areia, cimento e ferro), em atendimento à Secretaria Municipal de Obras.",,,,,,Prefeitura Municipal de Uberlândia
26188 - 2015,20/04/2016,6 - Pregão eletrônico,705,PLANO A COMERCIO E SERVICOS LTDA - ME,18000,"aquisição de materiais (tijolo prensado), em atendimento á Secretaria Municipal de Obras.",Secretaria Municipal de Obras,"Qual o valor gasto com aquisição de materiais (tijolo prensado), em atendimento á Secretaria Municipal de Obras.",,,,,,Prefeitura Municipal de Uberlândia
26876 - 2015,3/2/2016,1 - CONVITE,726,SEVENMIX COMERCIO E SERVICO EIRELI - ME,32390.6,"fornecimento de brita, para atender a Diretoria de Obras de Infraestrutura, em atendimente à Secretaria Municipal de Obras.",Secretaria Municipal de Obras,"Qual o valor gasto com fornecimento de brita, para atender a Diretoria de Obras de Infraestrutura, em atendimente à Secretaria Municipal de Obras.",,,,,,Prefeitura Municipal de Uberlândia
26892 - 2015,11/2/2016,1 - CONVITE,733,MADEIREIRA AIMORE EIRELI - EPP,8479.5,"aquisição de diversos materiais (caibro, tábua de 30cm, madeirite, vigota, sarrafo, etc), em atendimento à Secretaria Municipal de Obras.",Secretaria Municipal de Obras,"Qual o valor gasto com aquisição de diversos materiais (caibro, tábua de 30cm, madeirite, vigota, sarrafo, etc), em atendimento à Secretaria Municipal de Obras.",,,,,,Prefeitura Municipal de Uberlândia
26892 - 2015,11/2/2016,1 - CONVITE,733,SILVEIRA GUIMARAES MATERIAIS PARA CONSTRUCAO EIRELI - EPP,1980,"aquisição de diversos materiais (caibro, tábua de 30cm, madeirite, vigota, sarrafo, etc), em atendimento à Secretaria Municipal de Obras.",Secretaria Municipal de Obras,"Qual o valor gasto com aquisição de diversos materiais (caibro, tábua de 30cm, madeirite, vigota, sarrafo, etc), em atendimento à Secretaria Municipal de Obras.",,,,,,Prefeitura Municipal de Uberlândia
28027 - 2015,20/04/2016,3 - CONCORRÊNCIA,799,CONSTRUTORA SODESTE LTDA,4613855.99,"execução de obras e serviços em estradas vicinais no Município de Uberlândia/MG, com fornecimento de materiais e mão de obra, em atendimento à Secretaria Municipal de Obras.",Secretaria Municipal de Obras,"Qual o valor gasto com execução de obras e serviços em estradas vicinais no Município de Uberlândia/MG, com fornecimento de materiais e mão de obra, em atendimento à Secretaria Municipal de Obras.",,,,,,Prefeitura Municipal de Uberlândia
29001 - 2015,29/02/2016,6 - Pregão eletrônico,836,COMERCIAL BARACUI & SANTOS LTDA - EPP,138378,"aquisição de tubos de concreto para atender a Diretoria de Obras de Infraestrutura, em atendimento à Secretaria Municipal de Obras.",Secretaria Municipal de Obras,"Qual o valor gasto com aquisição de tubos de concreto para atender a Diretoria de Obras de Infraestrutura, em atendimento à Secretaria Municipal de Obras.",,,,,,Prefeitura Municipal de Uberlândia
29001 - 2015,29/02/2016,6 - Pregão eletrônico,836,ELDORADO MATERIAIS PARA CONSTRUCAO LTDA - EPP,19869,"aquisição de tubos de concreto para atender a Diretoria de Obras de Infraestrutura, em atendimento à Secretaria Municipal de Obras.",Secretaria Municipal de Obras,"Qual o valor gasto com aquisição de tubos de concreto para atender a Diretoria de Obras de Infraestrutura, em atendimento à Secretaria Municipal de Obras.",,,,,,Prefeitura Municipal de Uberlândia
29001 - 2015,29/02/2016,6 - Pregão eletrônico,836,MADEIREIRA REI DE MINAS EIRELI - EPP,31746,"aquisição de tubos de concreto para atender a Diretoria de Obras de Infraestrutura, em atendimento à Secretaria Municipal de Obras.",Secretaria Municipal de Obras,"Qual o valor gasto com aquisição de tubos de concreto para atender a Diretoria de Obras de Infraestrutura, em atendimento à Secretaria Municipal de Obras.",,,,,,Prefeitura Municipal de Uberlândia
29005 - 2015,18/05/2016,6 - Pregão eletrônico,837,ABC CONSULTORIA EM INFORMATICA LTDA - ME,18900,"manutenção corretiva e evolutiva de software, em atendimento à Secretaria Municipal de Obras.",Secretaria Municipal de Obras,"Qual o valor gasto com manutenção corretiva e evolutiva de software, em atendimento à Secretaria Municipal de Obras.",,,,,,Prefeitura Municipal de Uberlândia
29096 - 2015,21/03/2016,2 - TOMADA DE PREÇO,847,NASMAN INDUSTRIA COMERCIO E CONSTRUCOES LTDA,228998.6,"execução das obras e serviços de sinalização nos bairros Morumbi e Shopping Park na cidade de Uberlândia, em atendimento á Secretaria Municipal de Obras.",Secretaria Municipal de Obras,"Qual o valor gasto com execução das obras e serviços de sinalização nos bairros Morumbi e Shopping Park na cidade de Uberlândia, em atendimento á Secretaria Municipal de Obras.",,,,,,Prefeitura Municipal de Uberlândia
29718 - 2015,21/03/2016,3 - CONCORRÊNCIA,872,VEREDA ENGENHARIA LTDA,6284854.72,"implantação de viaduto em vigas pré-moldadas na Rua Olegário Maciel sobre a Av. Governador Rondon Pacheco, com fornecimento de materiais e mão de obra, em atendimento às Secretarias Municipais de Trânsito e Transportes e de Obras.",Secretaria Municipal de Obras,"Qual o valor gasto com implantação de viaduto em vigas pré-moldadas na Rua Olegário Maciel sobre a Av. Governador Rondon Pacheco, com fornecimento de materiais e mão de obra, em atendimento às Secretarias Municipais de Trânsito e Transportes e de Obras.",,,,,,Prefeitura Municipal de Uberlândia
30199 - 2015,25/08/2016,5 - PREGÃO PRESENCIAL,922,BUSCA PECAS COMERCIO LTDA - ME,436949.89,"prestação de serviços de manutenção e fornecimento de peças para equipamentos e máquinas elétricos e à gasolina/diesel, em atendimento à Secretaria Municipal de Obras e S. M. de Cultura.",Secretaria Municipal de Obras,"Qual o valor gasto com prestação de serviços de manutenção e fornecimento de peças para equipamentos e máquinas elétricos e à gasolina/diesel, em atendimento à Secretaria Municipal de Obras e S. M. de Cultura.",,,,,,Prefeitura Municipal de Uberlândia
30544 - 2015,22/07/2016,5 - PREGÃO PRESENCIAL,948,SELECTA SERVICOS GLOBALIZADO LTDA - EPP,369029.49,"futura e eventual prestação de serviços de locação de mão de obra de operadores de máquinas e motoristas de veículos pesados, em atendimento à Secretaria Municipal de Obras.",Secretaria Municipal de Obras,"Qual o valor gasto com futura e eventual prestação de serviços de locação de mão de obra de operadores de máquinas e motoristas de veículos pesados, em atendimento à Secretaria Municipal de Obras.",,,,,,Prefeitura Municipal de Uberlândia
11361 - 2016,29/07/2016,3 - CONCORRÊNCIA,262,TECSAN ENGENHARIA LTDA,1219776.47,"execução de obras de duplicação da Av. Aldo Borges Leão no trecho compreendido entre as proximidades dos nº 776 e nº 2200, no bairro Morada Nova na cidade de Uberlândia/MG, em atendimento à Secretaria Municipal de Obras.",Secretaria Municipal de Obras,"Qual o valor gasto com execução de obras de duplicação da Av. Aldo Borges Leão no trecho compreendido entre as proximidades dos nº 776 e nº 2200, no bairro Morada Nova na cidade de Uberlândia/MG, em atendimento à Secretaria Municipal de Obras.",,,,,,Prefeitura Municipal de Uberlândia
16986 - 2016,21/12/2016,3 - CONCORRÊNCIA,418,BT CONSTRUCOES LTDA.,1170936.82,"execução do prolongamento da Avenida Balaiadas entre os bairros Marta Helena e Nossa Senhora da Graças até a República Piratini, com fornecimento de mão de obra e material, em atendimento à Secretaria Municipal de Obras.",Secretaria Municipal de Obras,"Qual o valor gasto com execução do prolongamento da Avenida Balaiadas entre os bairros Marta Helena e Nossa Senhora da Graças até a República Piratini, com fornecimento de mão de obra e material, em atendimento à Secretaria Municipal de Obras.",,,,,,Prefeitura Municipal de Uberlândia
