Nº do Processo,Data da Homologação,Modalidade,Nº da Modalidade,Licitantes Vencedores,Valor Total Licitado,Objeto,Unidade Orcamentaria,Query objetos e empresas,Empresas participantes,Valor total por empresa,Empresas frequentes,Num Participações,Empresa com participação Única,UASG
16308 - 2015,28/09/2015,1 - CONVITE,329,"AR CONDICIONADO TURBO AR, COMERCIO E SERVICOS LTDA",6936.33,"fornecimento e instalação de 01 (um) aparelho de Ar Condicionado, 60.000 btu's, modelo piso-teto, 220v trifásico, em atendimento a Superintendência de Proteção e Defesa do Consumidor - PROCON da Secretaria Municipal de Governo",Secretaria Municipal de Governo,"Qual o valor gasto com fornecimento e instalação de 01 (um) aparelho de Ar Condicionado, 60.000 btu's, modelo piso-teto, 220v trifásico, em atendimento a Superintendência de Proteção e Defesa do Consumidor - PROCON da Secretaria Municipal de Governo",A SOS DEDETIZADORA E DESENTUPIDORA LTDA - ME,360,A1 LOCADORA E TRANSPORTES LTDA - ME,2,A SOS DEDETIZADORA E DESENTUPIDORA LTDA - ME,Prefeitura Municipal de Uberlândia
1132 - 2015,05/05/2015,5 - PREGÃO PRESENCIAL,3,COOPERATIVA AGROPECUARIA LTDA DE UBERLANDIA,213394,"futura ou eventual fornecimento de leite e manteiga, em atendimento às Secretarias e aos Órgãos da Administração Direta da Prefeitura Municipal de Uberlândua.",Secretaria Municipal de Governo,"Qual o valor gasto com futura ou eventual fornecimento de leite e manteiga, em atendimento às Secretarias e aos Órgãos da Administração Direta da Prefeitura Municipal de Uberlândia.",A1 LOCADORA E TRANSPORTES LTDA - ME,133500,ABC CONSULTORIA EM INFORMATICA LTDA - ME,2,A3D EMPREENDIMENTOS LTDA-ME,Prefeitura Municipal de Uberlândia
7128 - 2015,10/04/2015,1 - CONVITE,140,SISTEMAS DE ALARME MAXIMA SEGURANCA LTDA - EPP,621,prestação de serviços de monitoramento eletrônico de alarme com atendimento móvel 24 horas em atendimento a Superintendência da Pessoa com Deficiência e Mobilidade Urbana da Secretaria Municipal de Governo.,Secretaria Municipal de Governo,Qual o valor gasto com prestação de serviços de monitoramento eletrônico de alarme com atendimento móvel 24 horas em atendimento a Superintendência da Pessoa com Deficiência e Mobilidade Urbana da Secretaria Municipal de Governo.,A3D EMPREENDIMENTOS LTDA-ME,95000,ADA LUISA VIEIRA RODRIGUES - ME,2,ABEX COMERCIAL IMPORTACAO E EXPORTACAO LTDA - EPP,Prefeitura Municipal de Uberlândia
28722 - 2014,26/01/2015,5 - PREGÃO PRESENCIAL,951,COPAGAZ DISTRIBUIDORA DE GAS S.A,2190,"futuro e eventual fornecimento de gás de cozinha (GLP), em atendimento às Secretarias e Órgãos da Administração Direta da Prefeitura Municipal de Uberlândia.",Secretaria Municipal de Governo,"Qual o valor gasto com futuro e eventual fornecimento de gás de cozinha (GLP), em atendimento às Secretarias e Órgãos da Administração Direta da Prefeitura Municipal de Uberlândia.",ABC CONSULTORIA EM INFORMATICA LTDA - ME,41010.4,AGUA LIMPA PISCINAS E CAIXAS DE AGUA LTDA - ME,2,ACHEI INDUSTRIA DE MOVEIS PARA ESCRITORIO LTDA - ME,Prefeitura Municipal de Uberlândia
2451 - 2015,18/02/2015,1 - CONVITE,28,PNEUARA PNEUS COMERCIO IMPORTACAO E EXPORTACAO LTDA,39010,"aquisição de pneu 1400x24 lameiro 12 lonas e Câmara de Ar (nova) km 24, a serem utilizados nas frotas 380, 381, 383 e 384 - moto niveladora caterpillar, em atendimento à Superintendência de Operações e manutenção.",Secretaria Municipal de Governo,"Qual o valor gasto com aquisição de pneu 1400x24 lameiro 12 lonas e Câmara de Ar (nova) km 24, a serem utilizados nas frotas 380, 381, 383 e 384 - moto niveladora caterpillar, em atendimento à Superintendência de Operações e manutenção.",ABEX COMERCIAL IMPORTACAO E EXPORTACAO LTDA - EPP,32487.5,AL COMERCIO DE MATERIAIS DE ESCRITRIO LTDA - ME,4,ADEM DISTRIBUIDORA DE EQUIPAMENTOS MEDICOS LTDA,Prefeitura Municipal de Uberlândia
27878 - 2014,13/02/2015,5 - PREGÃO PRESENCIAL,918,C R BUFE E EVENTOS LTDA - ME,9880.4,"futuro ou eventual fornecimento de coffee break, em atendimento às Secretarias e aos Órgãos da Administração Direta da Prefeitura Municipal de Uberlândia.",Secretaria Municipal de Governo,"Qual o valor gasto com futuro ou eventual fornecimento de coffee break, em atendimento às Secretarias e aos Órgãos da Administração Direta da Prefeitura Municipal de Uberlândia.",ACHEI INDUSTRIA DE MOVEIS PARA ESCRITORIO LTDA - ME,32498,ALGAR CELULAR S/A,3,AGENCIA DE INTEGRACAO EMPRESA ESCOLA LTDA-ME,Prefeitura Municipal de Uberlândia
13047 - 2015,20/08/2015,6 - PREGÃO ELETRÔNICO,234,CENTRO AUTOMOTIVO CENTRO OESTE LTDA - ME,78218,"aquisição de materiais (óleo 15w 40, óleo ATF tipo A, óleo SAE 40 e outros), em atendimento à Superintência de Operações e manutenção.",Secretaria Municipal de Governo,"Qual o valor gasto com aquisição de materiais (óleo 15w 40, óleo ATF tipo A, óleo SAE 40 e outros), em atendimento à Superintência de Operações e manutenção.",ADA LUISA VIEIRA RODRIGUES - ME,85241.71,ALTERNATIVA COMERCIAL LTDA - ME,13,AIR LIQUIDE BRASIL LTDA,Prefeitura Municipal de Uberlândia
27723 - 2014,27/01/2015,5 - PREGÃO PRESENCIAL,911,OLIVEIRA & LOURENCO INDUSTRIA DE PANIFICACAO LTDA - ME,12600,"futuro e eventual fornecimento de pães, em atendimento às Secretarias e Órgãos da Administração Direta da Prefeitura Municipal de Uberlândia.",Secretaria Municipal de Governo,"Qual o valor gasto com futuro e eventual fornecimento de pães, em atendimento às Secretarias e Órgãos da Administração Direta da Prefeitura Municipal de Uberlândia.",ADEM DISTRIBUIDORA DE EQUIPAMENTOS MEDICOS LTDA,62520,"AR CONDICIONADO TURBO AR, COMERCIO E SERVICOS LTDA",5,ALERIANO ROSA DA SILVA - CPF 051.169.526-81 - ME,Prefeitura Municipal de Uberlândia
2657 - 2015,24/02/2015,1 - CONVITE,31,BARACUI COMERCIAL LTDA - ME,2887,"fornecimento de Painéis Perfil U Perfil H e portas para serem utilizados na estrutura da Superintendência da Juventude, em atendimento a Secretaria Municipal de Governo.",Secretaria Municipal de Governo,"Qual o valor gasto com fornecimento de Painéis Perfil U Perfil H e portas para serem utilizados na estrutura da Superintendência da Juventude, em atendimento a Secretaria Municipal de Governo.",AGENCIA DE INTEGRACAO EMPRESA ESCOLA LTDA-ME,100368,ARMAZENA INDUSTRIA DE MOVEIS LTDA - EPP,2,ALEXANDRE ALVES SILVA - 98658450678,Prefeitura Municipal de Uberlândia
28556 - 2014,01/04/2015,5 - PREGÃO PRESENCIAL,944,RB GRAFICA DIGITAL EIRELI - ME,4050,"prestação de serviços gráficos, em atendimento a Secretaria Muncipal de Governo.",Secretaria Municipal de Governo,"Qual o valor gasto com prestação de serviços gráficos, em atendimento a Secretaria Muncipal de Governo.",AGUA LIMPA PISCINAS E CAIXAS DE AGUA LTDA - ME,127710.29,ATITUDE COMERCIAL EIRELI - ME,20,ALGAR TELECOM S/A,Prefeitura Municipal de Uberlândia
25392 - 2015,27/10/2015,1 - CONVITE,683,PRADUSTUR LTDA,7999,"fretamento de ônibus (42 lugares, ar condicionado, TV/DVD, toalete e frigobar), para os membros da Superintendência da Pessoa com Deficiência e Mobilidade Urbana e Banda AB' Surdos do Conservatório, em atendimento à Secretaria Municipal de Governo.",Secretaria Municipal de Governo,"Qual o valor gasto com fretamento de ônibus (42 lugares, ar condicionado, TV/DVD, toalete e frigobar), para os membros da Superintendência da Pessoa com Deficiência e Mobilidade Urbana e Banda AB' Surdos do Conservatório, em atendimento à Secretaria Municipal de Governo.",AIR LIQUIDE BRASIL LTDA,289710,AUTO POSTO VIEIRA E MARTINS LTDA,3,ALGUS INDUSTRIA COMERCIO E DISTRIBUICAO EIRELI,Prefeitura Municipal de Uberlândia
31014 - 2014,06/01/2015,1 - CONVITE,1027,BUSCA PECAS COMERCIO LTDA - ME,21922,"fornecimento de diversas peças e conserto para as frotas: (182/GMM6439 226/GMM6498 310/GMM6332 41/GMM6160 420/HMM7307 314/GMM6513 99/GMM6529 296/KDU2757 500/GRA1800 e 644/CVP7321, em atendimento à Sup. de Operações e manutenção.",Secretaria Municipal de Governo,"Qual o valor gasto com fornecimento de diversas peças e conserto para as frotas: (182/GMM6439 226/GMM6498 310/GMM6332 41/GMM6160 420/HMM7307 314/GMM6513 99/GMM6529 296/KDU2757 500/GRA1800 e 644/CVP7321, em atendimento à Sup. de Operações e manutenção.",AL COMERCIO DE MATERIAIS DE ESCRITRIO LTDA - ME,106976,BARACUI COMERCIAL LTDA - ME,29,ALINE EDITORA E ARTES GRAFICAS LTDA,Prefeitura Municipal de Uberlândia
7476 - 2015,13/05/2015,1 - CONVITE,150,DESTRA ARQUITETURA LTDA - ME,67283.75,"prestação de serviço de elaboração de projetos executivos para obra de construção da sede da Superintendência de Proteção e Defesa do Consumidor PROCON, em atendimento à Secretaria Municipal de Governo.",Secretaria Municipal de Governo,"Qual o valor gasto com prestação de serviço de elaboração de projetos executivos para obra de construção da sede da Superintendência de Proteção e Defesa do Consumidor PROCON, em atendimento à Secretaria Municipal de Governo.",ALERIANO ROSA DA SILVA - CPF 051.169.526-81 - ME,700,BARRA PROJETOS E CONSTRUCOES LTDA,6,AMAZONAS GRAFICA DE ADESIVOS E BRINDES LTDA ME,Prefeitura Municipal de Uberlândia
26348 - 2014,24/03/2015,1 - CONVITE,850,MENDONCA & FERNANDES LTDA -ME,4216,"aquisição de diversos equipamentos para áudio (microfone sem fio, microfone com fio, caixa de som, mesa de som amplificada e tripé para caixa de som), em atendimento à Superintendência da Mulher da Secretaria Municipal de Governo.",Secretaria Municipal de Governo,"Qual o valor gasto com aquisição de diversos equipamentos para áudio (microfone sem fio, microfone com fio, caixa de som, mesa de som amplificada e tripé para caixa de som), em atendimento à Superintendência da Mulher da Secretaria Municipal de Governo.",ALEXANDRE ALVES SILVA - 98658450678,2702.08,BEIJA-FLORZINHO MATERIAIS PARA CONSTRUCAO EIRELI - ME,9,AMAZONIA INDUSTRIA E COMERCIO LTDA,Prefeitura Municipal de Uberlândia
27204 - 2014,01/04/2015,5 - PREGÃO PRESENCIAL,886,BUSCA PECAS COMERCIO LTDA - ME,393999.29,"prestação de serviços de manutenção, consertos e fornecimento de peças para serviços de suspensão nos veículos pesados que compõem a frota municipal, em atendimento a Superintendência de Operações e manutenção.",Secretaria Municipal de Governo,"Qual o valor gasto com prestação de serviços de manutenção, consertos e fornecimento de peças para serviços de suspensão nos veículos pesados que compõem a frota municipal, em atendimento a Superintendência de Operações e manutenção.",ALGAR CELULAR S/A,143096.4,BH FOODS COMERCIO E INDUSTRIA LTDA-EPP,2,ANDAIMES MONTAGENS E EVENTOS LTDA - ME,Prefeitura Municipal de Uberlândia
31123 - 2014,09/04/2015,5 - PREGÃO PRESENCIAL,1034,DIEGO ALBERTO RAMOS RAFAEL - ME,1492.2,futura ou eventual fornecimento de produtos para coffee break em atendimento às Secretarias e Órgãos da Administração Direta da Prefeitura Municipal de Uberlândia.,Secretaria Municipal de Governo,Qual o valor gasto com futura ou eventual fornecimento de produtos para coffee break em atendimento às Secretarias e Órgãos da Administração Direta da Prefeitura Municipal de Uberlândia.,ALGAR TELECOM S/A,14928.2,BILHAR SENA LTDA,2,ARAUJO E PEREIRA TRANSPORTES LTDA - ME,Prefeitura Municipal de Uberlândia
2733 - 2015,25/02/2015,1 - CONVITE,36,T & I TELECOMUNICACOES LTDA - EPP,9790,prestação de serviço de assessoramento técnico e execução de serviços de atualização de sistema e processamentos de dados nos servidores e demais máquinas para nova sede do PROCON em atendimento a Secretaria Municipal de Governo.,Secretaria Municipal de Governo,Qual o valor gasto com prestação de serviço de assessoramento técnico e execução de serviços de atualização de sistema e processamentos de dados nos servidores e demais máquinas para nova sede do PROCON em atendimento a Secretaria Municipal de Governo.,ALGUS INDUSTRIA COMERCIO E DISTRIBUICAO EIRELI,10524,BT CONSTRUCOES LTDA.,2,ARCO VERDE MEIO AMBIENTE LTDA - ME,Prefeitura Municipal de Uberlândia
7280 - 2015,25/06/2015,1 - CONVITE,144,SEVENMIX COMERCIO E SERVICO EIRELI - ME,6300,"aquisição de tenda com motor (modelo casa), a ser utilizada nos eventos do Procon móvel, em atendimento à Superintendência de Proteção e Defesa do Consumidor - PROCON da Secretaria Municipal de Governo.",Secretaria Municipal de Governo,"Qual o valor gasto com aquisição de tenda com motor (modelo casa), a ser utilizada nos eventos do Procon móvel, em atendimento à Superintendência de Proteção e Defesa do Consumidor - PROCON da Secretaria Municipal de Governo.",ALINE EDITORA E ARTES GRAFICAS LTDA,9910,BUSCA PECAS COMERCIO LTDA - ME,9,ARCOVERDE SOLUCOES GRAFICAS LTDA - ME,Prefeitura Municipal de Uberlândia
29106 - 2014,19/03/2015,5 - PREGÃO PRESENCIAL,963,CAPITAL SEGURANCA CONTRA INCENDIO UBERLANDIA LTDA - ME,1870,"fornecimento de recargas, testes hidrostáticos, pesagens e substituião de peças em estintores de incêndio, em atendimento às Secretarias e aos Órgãos da Administração Direta da Prefeitura Municipal de Uberlândia.",Secretaria Municipal de Governo,"Qual o valor gasto com fornecimento de recargas, testes hidrostáticos, pesagens e substituião de peças em estintores de incêndio, em atendimento às Secretarias e aos Órgãos da Administração Direta da Prefeitura Municipal de Uberlândia.",ALTERNATIVA COMERCIAL LTDA - ME,1307448.3,C R BUFE E EVENTOS LTDA - ME,18,ARTE ORIGINAL LTDA,Prefeitura Municipal de Uberlândia
30961 - 2014,09/01/2015,1 - CONVITE,1021,BUSCA PECAS COMERCIO LTDA - ME,2800,"manutenção de veículos (frota 100/GMM6453/78 e 271/GMM0180/91), em atendimento à Superintendência de Operações e manutenção.",Secretaria Municipal de Governo,"Qual o valor gasto com manutenção de veículos (frota 100/GMM6453/78 e 271/GMM0180/91), em atendimento à Superintendência de Operações e manutenção.",AMAZONAS GRAFICA DE ADESIVOS E BRINDES LTDA ME,180,CAPITAL SEGURANCA CONTRA INCENDIO UBERLANDIA LTDA - ME,13,ASENHORINHA TRANSPORTES LTDA - ME,Prefeitura Municipal de Uberlândia
27844 - 2014,10/09/2014,5 - PREGÃO PRESENCIAL,915,TRADE MARKETING HOTEIS TURISMO E EVENTOS LTDA,40000,"futura e eventual prestação de serviços de reserva, emissão, marcação, reemissão, cancelamento e reembolso de bilhetes de passagens aéreas nacionais e internacionais, em atendimento às Secretarias e Órgãos da Administração Direta da PMU.",Secretaria Municipal de Governo,"Qual o valor gasto com futura e eventual prestação de serviços de reserva, emissão, marcação, reemissão, cancelamento e reembolso de bilhetes de passagens aéreas nacionais e internacionais, em atendimento às Secretarias e Órgãos da Administração Direta da PMU.",AMAZONIA INDUSTRIA E COMERCIO LTDA,255960,CASA MARCELO DE FERRAGENS LTDA-EPP,2,"ASSOC MOT TRANS PASS EST GOIAS, TOCANTINS E MINA GERAIS",Prefeitura Municipal de Uberlândia
6736 - 2015,07/04/2015,1 - CONVITE,129,OPEL AUTO CENTER COMERCIO DE PECAS LTDA - ME,25000,"contratação de empresa especializada para o serviço de guincho em veículos leves, caminhonetes, vans e tratores, até 2.500 Kg., com assistência 24 horas, em atendimento a Superintendência de Operações e manutenção.",Secretaria Municipal de Governo,"Qual o valor gasto com contratação de empresa especializada para o serviço de guincho em veículos leves, caminhonetes, vans e tratores, até 2.500 Kg., com assistência 24 horas, em atendimento a Superintendência de Operações e manutenção.",ANDAIMES MONTAGENS E EVENTOS LTDA - ME,12800,CENTRO AUTOMOTIVO CENTRO OESTE LTDA - ME,2,ASSOCIACAO DOS TRANSPORTADORES DE PASSAGEIROS E CARGAS DO TR,Prefeitura Municipal de Uberlândia
13780 - 2015,01/07/2015,1 - CONVITE,255,FRANCISCO VIEIRA DE MORAES - ME,62393.86,"fornecimento de diversas peças (thinner, kit de embreagem, etc.) e para o serviço de mecânica (adaptar sede, esmerilar e assentar cabeçote, etc.), em atendimento a Superintendência de Operações e manutenção.",Secretaria Municipal de Governo,"Qual o valor gasto com fornecimento de diversas peças (thinner, kit de embreagem, etc.) e para o serviço de mecânica (adaptar sede, esmerilar e assentar cabeçote, etc.), em atendimento a Superintendência de Operações e manutenção.","AR CONDICIONADO TURBO AR, COMERCIO E SERVICOS LTDA",31874.32,CIRURGICA ALIANCA PRODUTOS HOSPITALARES LTDA,3,ATHIKA COMERCIO DE MOVEIS EIRELI - EPP,Prefeitura Municipal de Uberlândia
20278 - 2015,09/09/2015,1 - CONVITE,461,FRANCISCO VIEIRA DE MORAES - ME,12898.98,"fornecimento de diversas peças (filtro lubrificante, kit motor, válvula termostática, etc.) e para serviço de mecânica (mandrilhar capa mancal, plainar bloco, etc.), frota P/385 GMM5290 em atendimento a Superintendência de Operações e manutenção.",Secretaria Municipal de Governo,"Qual o valor gasto com fornecimento de diversas peças (filtro lubrificante, kit motor, válvula termostática, etc.) e para serviço de mecânica (mandrilhar capa mancal, plainar bloco, etc.), frota P/385 GMM5290 em atendimento a Superintendência de Operações e manutenção.",ARAUJO E PEREIRA TRANSPORTES LTDA - ME,25000,CIRURGICA ODONTO VIDA LTDA ME,3,AUTO POSTO ENERGY LTDA.,Prefeitura Municipal de Uberlândia
11638 - 2015,28/08/2015,5 - PREGÃO PRESENCIAL,197,COM TECH INFORMATICA LTDA,1764.1,futura ou eventual locação de equipamentos de informática (microcomputadores e outros) em atendimento às Secretarias e aos Órgãos da Administração DIreta da Prefeitura Municipal de Uberlândia,Secretaria Municipal de Governo,Qual o valor gasto com futura ou eventual locação de equipamentos de informática (microcomputadores e outros) em atendimento às Secretarias e aos Órgãos da Administração DIreta da Prefeitura Municipal de Uberlândia,ARCO VERDE MEIO AMBIENTE LTDA - ME,195717.6,CIRURGICA ZANIN LTDA - EPP,10,AUTUS COMERCIAL DISTRIBUIDORA LTDA,Prefeitura Municipal de Uberlândia
29115 - 2014,27/04/2015,5 - PREGÃO PRESENCIAL,966,SISTEMAS DE ALARME MAXIMA SEGURANCA LTDA - EPP,950.4,"aquisição de materiais para alarme (sirene branca para alarme, cabo 4 vias para alarme, ateria selada VRLA para alarme e outros), em atendimento às Secretarias Municipais de Saúde e de Governo.",Secretaria Municipal de Governo,"Qual o valor gasto com aquisição de materiais para alarme (sirene branca para alarme, cabo 4 vias para alarme, ateria selada VRLA para alarme e outros), em atendimento às Secretarias Municipais de Saúde e de Governo.",ARCOVERDE SOLUCOES GRAFICAS LTDA - ME,21540,COCAL CEREAIS LTDA,5,AZM EMPREENDIMENTOS IMOBILIARIOS LTDA,Prefeitura Municipal de Uberlândia
14958 - 2015,26/06/2015,1 - CONVITE,289,EXTINTORES REGIONAL LTDA - EPP,13000,"fornecimento de extintores automotivos PP. 02 Kg Abc, para utilização nos caminhões da frota Municipal, em atendimento à Superintendencia de Operações e manutenção.",Secretaria Municipal de Governo,"Qual o valor gasto com fornecimento de extintores automotivos PP. 02 Kg Abc, para utilização nos caminhões da frota Municipal, em atendimento à Superintendencia de Operações e manutenção.",ARMAZENA INDUSTRIA DE MOVEIS LTDA - EPP,17336,COM TECH INFORMATICA LTDA,15,AZUL ESPORTES COMERCIAL LIMITADA - EPP,Prefeitura Municipal de Uberlândia
15744 - 2015,14/07/2015,1 - CONVITE,318,UDI TRATORES COMERCIO DE PECAS E SERVICOS LTDA - ME,5755.19,"aquisição de diversas peças (porta injetor, bico injetor, reparo, alavanca, valvula, elementl anel, etc..) para atender o veículo 420/HMM7307 Ford Cargo/01 em atendimento a Superintendência de Operações e manutenção.",Secretaria Municipal de Governo,"Qual o valor gasto com aquisição de diversas peças (porta injetor, bico injetor, reparo, alavanca, valvula, elementl anel, etc..) para atender o veículo 420/HMM7307 Ford Cargo/01 em atendimento a Superintendência de Operações e manutenção.",ARTE ORIGINAL LTDA,38289,COMERCIAL BARACUI & SANTOS LTDA - EPP,24,BETANIAMED COMERCIAL EIRELI - EPP,Prefeitura Municipal de Uberlândia
28360 - 2014,13/03/2015,5 - PREGÃO PRESENCIAL,937,AUTO POSTO VIEIRA E MARTINS LTDA,2288440,"aquisição de combustíveis (gasolina tipo C, óleo diesel B S-10, etanol hidratado e balde 20 litros ARLA 32), em atendimento à Sec. Mun. Saúde, Sec. Mun. de Cultura e Sup. de Operações e manutenção.",Secretaria Municipal de Governo,"Qual o valor gasto com aquisição de combustíveis (gasolina tipo C, óleo diesel B S-10, etanol hidratado e balde 20 litros ARLA 32), em atendimento à Sec. Mun. Saúde, Sec. Mun. de Cultura e Sup. de Operações e manutenção.",ASENHORINHA TRANSPORTES LTDA - ME,7900,COMERCIAL ELETRO - EIRELI - EPP,12,BIOFOR COMERCIO DE REAGENTES LTDA-EPP,Prefeitura Municipal de Uberlândia
26348 - 2014,24/03/2015,1 - CONVITE,850,H SOM SONORIZACAO & ASSISTENCIA TECNICA LTDA - EPP,4074,"aquisição de diversos equipamentos para áudio (microfone sem fio, microfone com fio, caixa de som, mesa de som amplificada e tripé para caixa de som), em atendimento à Superintendência da Mulher da Secretaria Municipal de Governo.",Secretaria Municipal de Governo,"Qual o valor gasto com aquisição de diversos equipamentos para áudio (microfone sem fio, microfone com fio, caixa de som, mesa de som amplificada e tripé para caixa de som), em atendimento à Superintendência da Mulher da Secretaria Municipal de Governo.","ASSOC MOT TRANS PASS EST GOIAS, TOCANTINS E MINA GERAIS",7173500,COMERCIAL GRANADA MATERIAIS DE ESCRITORIO LTDA - EPP,25,BIOHOSP PRODUTOS HOSPITALARES LTDA,Prefeitura Municipal de Uberlândia
30061 - 2014,15/04/2015,5 - PREGÃO PRESENCIAL,993,COMERCIAL BARACUI & SANTOS LTDA - EPP,2793,"fornecimento de baterias automotivas, em atendimento à Superintendência de Operações e manutenção.",Secretaria Municipal de Governo,"Qual o valor gasto com fornecimento de baterias automotivas, em atendimento à Superintendência de Operações e manutenção.",ASSOCIACAO DOS TRANSPORTADORES DE PASSAGEIROS E CARGAS DO TR,83420,COMERCIAL LORENA LTDA - EPP,8,BOHRER EQUIPAMENTOS DE AUDIO E VIDEO EIRELI-ME,Prefeitura Municipal de Uberlândia
13578 - 2015,24/07/2015,5 - PREGÃO PRESENCIAL,252,LF EMPRESARIAL LTDA - EPP,122514,"futura ou eventual aquisição de pneus, câmaras de ar e fitões, em atendimento á Superintendência de Operações e Manuntenção.",Secretaria Municipal de Governo,"Qual o valor gasto com futura ou eventual aquisição de pneus, câmaras de ar e fitões, em atendimento á Superintendência de Operações e Manuntenção.",ATHIKA COMERCIO DE MOVEIS EIRELI - EPP,16250,COMERCIAL MACKEY LTDA - ME,8,BUDNY INDUSTRIA E COMERCIO EIRELI,Prefeitura Municipal de Uberlândia
25024 - 2015,06/11/2015,1 - CONVITE,666,PORTO SEGURO COMPANHIA DE SEGUROS GERAIS,1292,"fornecimento de apólice de seguro para veículo (Fiat Uno Way, placa PUD 2114), em atendimento à Secretaria Municipal de Governo.",Secretaria Municipal de Governo,"Qual o valor gasto com fornecimento de apólice de seguro para veículo (Fiat Uno Way, placa PUD 2114), em atendimento à Secretaria Municipal de Governo.",ATITUDE COMERCIAL EIRELI - ME,1237080.4,COMETA DISTRIBUIDORA DE PECAS E SERVICOS LTDA - ME,2,C A L VICENTE NUTRICAO ANIMAL ME,Prefeitura Municipal de Uberlândia
30061 - 2014,15/04/2015,5 - PREGÃO PRESENCIAL,993,BUSCA PECAS COMERCIO LTDA - ME,16923,"fornecimento de baterias automotivas, em atendimento à Superintendência de Operações e manutenção.",Secretaria Municipal de Governo,"Qual o valor gasto com fornecimento de baterias automotivas, em atendimento à Superintendência de Operações e manutenção.",AUTO POSTO ENERGY LTDA.,40680,COMIGO COMERCIAL MINAS GOIAS LTDA - EPP,24,C.B.S SONORIZACAO EIRELI,Prefeitura Municipal de Uberlândia
13789 - 2015,01/07/2015,1 - CONVITE,255,FRANCISCO VIEIRA DE MORAES - ME,5900,"fornecimento de diversas peças (thinner, kit de embreagem, etc.) e para o serviço de mecânica (adaptar sede, esmerilar e assentar cabeçote, etc.), em atendimento a Superintendência de Operações e manutenção.",Secretaria Municipal de Governo,"Qual o valor gasto com fornecimento de diversas peças (thinner, kit de embreagem, etc.) e para o serviço de mecânica (adaptar sede, esmerilar e assentar cabeçote, etc.), em atendimento a Superintendência de Operações e manutenção.",AUTO POSTO VIEIRA E MARTINS LTDA,2704970,COMPANHIA MINEIRA DE ELETRIFICACAO LTDA,2,CADERPEL COMERCIO LTDA - ME,Prefeitura Municipal de Uberlândia
6479 - 2015,30/06/2015,5 - PREGÃO PRESENCIAL,124,AUTO POSTO ENERGY LTDA.,40680,"fornecimento de combustível (etanol hidratado), em atendimento à Superintendência de Operações e manutenção.",Secretaria Municipal de Governo,"Qual o valor gasto com fornecimento de combustível (etanol hidratado), em atendimento à Superintendência de Operações e manutenção.",AUTUS COMERCIAL DISTRIBUIDORA LTDA,145300,CONCORRENCIA COMERCIO E SERVICOS LTD-EPP,2,CAMILA LOUISE DE SOUZA,Prefeitura Municipal de Uberlândia
8298 - 2015,13/05/2015,1 - CONVITE,162,SHG COMERCIO E SERVICOS LTDA - ME,4100,"fornecimento de estante de aço 1,98x0,92x0,40 metros,com 06 (seis) bandeijas, em atendimento à Superintendência de Proteção e Defesa do Consumidor da Secretaria Municipal de Governo.",Secretaria Municipal de Governo,"Qual o valor gasto com fornecimento de estante de aço 1,98x0,92x0,40 metros,com 06 (seis) bandeijas, em atendimento à Superintendência de Proteção e Defesa do Consumidor da Secretaria Municipal de Governo.",AZM EMPREENDIMENTOS IMOBILIARIOS LTDA,3392260.83,CONSTRU VIDRO COMERCIO E SERVICOS LTDA - ME,2,CAPERPASS INDU E COMERCIO DE ARTIGOS PLASTICOS LTDA - ME,Prefeitura Municipal de Uberlândia
