27878 - 2014,13/02/2015,5 - PREGÃO PRESENCIAL,918,C R BUFE E EVENTOS LTDA - ME,23248,"futuro ou eventual fornecimento de coffee break, em atendimento às Secretarias e aos Órgãos da Administração Direta da Prefeitura Municipal de Uberlândia.","Secretaria Municipal de Gestão Estratégica, Ciência e Tecnologia","Qual o valor gasto com futuro ou eventual fornecimento de coffee break, em atendimento às Secretarias e aos Órgãos da Administração Direta da Prefeitura Municipal de Uberlândia.",,,,,,Prefeitura Municipal de Uberlândia
27844 - 2014,10/09/2014,5 - PREGÃO PRESENCIAL,915,TRADE MARKETING HOTEIS TURISMO E EVENTOS LTDA,10000,"futura e eventual prestação de serviços de reserva, emissão, marcação, reemissão, cancelamento e reembolso de bilhetes de passagens aéreas nacionais e internacionais, em atendimento às Secretarias e Órgãos da Administração Direta da PMU.","Secretaria Municipal de Gestão Estratégica, Ciência e Tecnologia","Qual o valor gasto com futura e eventual prestação de serviços de reserva, emissão, marcação, reemissão, cancelamento e reembolso de bilhetes de passagens aéreas nacionais e internacionais, em atendimento às Secretarias e Órgãos da Administração Direta da PMU.",,,,,,Prefeitura Municipal de Uberlândia
27723 - 2014,27/01/2015,5 - PREGÃO PRESENCIAL,911,OLIVEIRA & LOURENCO INDUSTRIA DE PANIFICACAO LTDA - ME,2112,"futuro e eventual fornecimento de pães, em atendimento às Secretarias e Órgãos da Administração Direta da Prefeitura Municipal de Uberlândia.","Secretaria Municipal de Gestão Estratégica, Ciência e Tecnologia","Qual o valor gasto com futuro e eventual fornecimento de pães, em atendimento às Secretarias e Órgãos da Administração Direta da Prefeitura Municipal de Uberlândia.",,,,,,Prefeitura Municipal de Uberlândia
22698 - 2014,09/06/2015,6 - PREGÃO ELETRÔNICO,734,COMIGO COMERCIAL MINAS GOIAS LTDA - EPP,117.5,"aquisição de aparelhos domésticos, em atendimento às Secretarias Municipais de Gestão Estratégica, Ciência e Tecnologia e de Saúde.","Secretaria Municipal de Gestão Estratégica, Ciência e Tecnologia","Qual o valor gasto com aquisição de aparelhos domésticos, em atendimento às Secretarias Municipais de Gestão Estratégica, Ciência e Tecnologia e de Saúde.",,,,,,Prefeitura Municipal de Uberlândia
1132 - 2015,05/05/2015,5 - PREGÃO PRESENCIAL,3,COOPERATIVA AGROPECUARIA LTDA DE UBERLANDIA,952.4,"futura ou eventual fornecimento de leite e manteiga, em atendimento às Secretarias e aos Órgãos da Administração Direta da Prefeitura Municipal de Uberlândua.","Secretaria Municipal de Gestão Estratégica, Ciência e Tecnologia","Qual o valor gasto com futura ou eventual fornecimento de leite e manteiga, em atendimento às Secretarias e aos Órgãos da Administração Direta da Prefeitura Municipal de Uberlândia.",,,,,,Prefeitura Municipal de Uberlândia
11638 - 2015,28/08/2015,5 - PREGÃO PRESENCIAL,197,DOMINIUM INFORMATICA LTDA,12600,futura ou eventual locação de equipamentos de informática (microcomputadores e outros) em atendimento às Secretarias e aos Órgãos da Administração DIreta da Prefeitura Municipal de Uberlândia,Secretaria Municipal de Planejamento Urbano,Qual o valor gasto com futura ou eventual locação de equipamentos de informática (microcomputadores e outros) em atendimento às Secretarias e aos Órgãos da Administração DIreta da Prefeitura Municipal de Uberlândia,,,,,,Prefeitura Municipal de Uberlândia
1421 - 2014,12/05/2014,5 - PREGÃO PRESENCIAL,8,COM TECH INFORMATICA LTDA,87109.56,"locação de equipamentos de informática, com sistemas operacionais e outros softwares, prestação de serviços de manutenção, mão de obra e substituição de peças e/ou equipamentos a serem utilizados pelas Secretarias e Órgãos da Adm. Direta da PMU.",Secretaria Municipal de Planejamento Urbano,"Qual o valor gasto com locação de equipamentos de informática, com sistemas operacionais e outros softwares, prestação de serviços de manutenção, mão de obra e substituição de peças e/ou equipamentos a serem utilizados pelas Secretarias e Órgãos da Adm. Direta da PMU.",,,,,,Prefeitura Municipal de Uberlândia
1132 - 2015,05/05/2015,5 - PREGÃO PRESENCIAL,3,COOPERATIVA AGROPECUARIA LTDA DE UBERLANDIA,4284,"futura ou eventual fornecimento de leite e manteiga, em atendimento às Secretarias e aos Órgãos da Administração Direta da Prefeitura Municipal de Uberlândua.",Secretaria Municipal de Planejamento Urbano,"Qual o valor gasto com futura ou eventual fornecimento de leite e manteiga, em atendimento às Secretarias e aos Órgãos da Administração Direta da Prefeitura Municipal de Uberlândia.",,,,,,Prefeitura Municipal de Uberlândia
16197 - 2015,04/08/2015,1 - CONVITE,323,COMERCIAL LORENA LTDA - EPP,1905,"Recarga de cartuchos da empressora HP (Laserjet Pro CM 1415 FNW Color MFP), em atendimento a Secretaria Municipal de Planejamento Urbano.",Secretaria Municipal de Planejamento Urbano,"Qual o valor gasto com Recarga de cartuchos da empressora HP (Laserjet Pro CM 1415 FNW Color MFP), em atendimento a Secretaria Municipal de Planejamento Urbano.",,,,,,Prefeitura Municipal de Uberlândia
19307 - 2014,03/03/2015,5 - PREGÃO PRESENCIAL,627,MIDIAPEL PAPELARIA E INFORMATICA LTDA - ME,1980.85,"aquisição de materiais diversos (cartucho de reposição, barbante, grampeador, caderno de ata e outros) em atendimento a Secretaria Municipal de de Educação e Secretaria Municipal de Planejamento Urbanos.",Secretaria Municipal de Planejamento Urbano,"Qual o valor gasto com aquisição de materiais diversos (cartucho de reposição, barbante, grampeador, caderno de ata e outros) em atendimento a Secretaria Municipal de de Educação e Secretaria Municipal de Planejamento Urbanos.",,,,,,Prefeitura Municipal de Uberlândia
27723 - 2014,27/01/2015,5 - PREGÃO PRESENCIAL,911,OLIVEIRA & LOURENCO INDUSTRIA DE PANIFICACAO LTDA - ME,7200,"futuro e eventual fornecimento de pães, em atendimento às Secretarias e Órgãos da Administração Direta da Prefeitura Municipal de Uberlândia.",Secretaria Municipal de Planejamento Urbano,"Qual o valor gasto com futuro e eventual fornecimento de pães, em atendimento às Secretarias e Órgãos da Administração Direta da Prefeitura Municipal de Uberlândia.",,,,,,Prefeitura Municipal de Uberlândia
19307 - 2014,03/03/2015,5 - PREGÃO PRESENCIAL,627,PAPELARIA COMERCIAL DE UBERLANDIA LTDA - EPP,319.2,"aquisição de materiais diversos (cartucho de reposição, barbante, grampeador, caderno de ata e outros) em atendimento a Secretaria Municipal de de Educação e Secretaria Municipal de Planejamento Urbanos.",Secretaria Municipal de Planejamento Urbano,"Qual o valor gasto com aquisição de materiais diversos (cartucho de reposição, barbante, grampeador, caderno de ata e outros) em atendimento a Secretaria Municipal de de Educação e Secretaria Municipal de Planejamento Urbanos.",,,,,,Prefeitura Municipal de Uberlândia
19953 - 2015,25/11/2015,6 - PREGÃO ELETRÔNICO,453,ARCOVERDE SOLUCOES GRAFICAS LTDA - ME,21540,"prestação de serviços gráficos, em atendimento à Secretaria Municípal de Planejamento Urbano.",Secretaria Municipal de Planejamento Urbano,"Qual o valor gasto com prestação de serviços gráficos, em atendimento à Secretaria Municípal de Planejamento Urbano.",,,,,,Prefeitura Municipal de Uberlândia
27844 - 2014,10/09/2014,5 - PREGÃO PRESENCIAL,915,TRADE MARKETING HOTEIS TURISMO E EVENTOS LTDA,10000,"futura e eventual prestação de serviços de reserva, emissão, marcação, reemissão, cancelamento e reembolso de bilhetes de passagens aéreas nacionais e internacionais, em atendimento às Secretarias e Órgãos da Administração Direta da PMU.",Secretaria Municipal de Planejamento Urbano,"Qual o valor gasto com futura e eventual prestação de serviços de reserva, emissão, marcação, reemissão, cancelamento e reembolso de bilhetes de passagens aéreas nacionais e internacionais, em atendimento às Secretarias e Órgãos da Administração Direta da PMU.",,,,,,Prefeitura Municipal de Uberlândia
26065 - 2013,17/06/2014,5 - PREGÃO PRESENCIAL,1140,R S BRASIL COMERCIAL LTDA- EPP,258.45,"aquisição de materiais de escritório (agenda, almofada para carimbo, apontados de lápis, caneta, etc), em atendimento à Secretarias e aos Órgãos da Administração Direta da Prefeitura Municipal de Uberlândia","Secretaria Municipal de Prevenção as Drogas, Defesa Social e Defesa Civil","Qual o valor gasto com aquisição de materiais de escritório (agenda, almofada para carimbo, apontados de lápis, caneta, etc), em atendimento à Secretarias e aos Órgãos da Administração Direta da Prefeitura Municipal de Uberlândia",,,,,,Prefeitura Municipal de Uberlândia
27844 - 2014,10/09/2014,5 - PREGÃO PRESENCIAL,915,TRADE MARKETING HOTEIS TURISMO E EVENTOS LTDA,7000,"futura e eventual prestação de serviços de reserva, emissão, marcação, reemissão, cancelamento e reembolso de bilhetes de passagens aéreas nacionais e internacionais, em atendimento às Secretarias e Órgãos da Administração Direta da PMU.","Secretaria Municipal de Prevenção as Drogas, Defesa Social e Defesa Civil","Qual o valor gasto com futura e eventual prestação de serviços de reserva, emissão, marcação, reemissão, cancelamento e reembolso de bilhetes de passagens aéreas nacionais e internacionais, em atendimento às Secretarias e Órgãos da Administração Direta da PMU.",,,,,,Prefeitura Municipal de Uberlândia
31122 - 2014,06/04/2015,5 - PREGÃO PRESENCIAL,1033,EPS EMPREENDIMENTOS S/A,2985,"futura ou eventual contratação de empresa especializada na prestação de serviços de hospedagem, em atendimento às Secretarias e aos Órgãos da Administração Direta da Prefeitura Municipal de Uberlândia.","Secretaria Municipal de Prevenção as Drogas, Defesa Social e Defesa Civil","Qual o valor gasto com futura ou eventual contratação de empresa especializada na prestação de serviços de hospedagem, em atendimento às Secretarias e aos Órgãos da Administração Direta da Prefeitura Municipal de Uberlândia.",,,,,,Prefeitura Municipal de Uberlândia
20399 - 2015,18/12/2015,5 - PREGÃO PRESENCIAL,474,COMERCIAL ELETRO - EIRELI - EPP,7961.04,"futuro e eventual fornecimento de materiais esportivos, em atendimento às Secretarias e aos Órgãos da Administração Direta da Prefeitura Municipal de Uberlândia.","Secretaria Municipal de Prevenção as Drogas, Defesa Social e Defesa Civil","Qual o valor gasto com futuro e eventual fornecimento de materiais esportivos, em atendimento às Secretarias e aos Órgãos da Administração Direta da Prefeitura Municipal de Uberlândia.",,,,,,Prefeitura Municipal de Uberlândia
26065 - 2013,17/06/2014,5 - PREGÃO PRESENCIAL,1140,PAPELARIA GLOBO LTDA - EPP,128.25,"aquisição de materiais de escritório (agenda, almofada para carimbo, apontados de lápis, caneta, etc), em atendimento à Secretarias e aos Órgãos da Administração Direta da Prefeitura Municipal de Uberlândia","Secretaria Municipal de Prevenção as Drogas, Defesa Social e Defesa Civil","Qual o valor gasto com aquisição de materiais de escritório (agenda, almofada para carimbo, apontados de lápis, caneta, etc), em atendimento à Secretarias e aos Órgãos da Administração Direta da Prefeitura Municipal de Uberlândia",,,,,,Prefeitura Municipal de Uberlândia
28727 - 2014,06/02/2015,5 - PREGÃO PRESENCIAL,952,SANTA CHIARA RESTAURANTE LTDA,3450,futuro ou eventual fornecimento de refeições a la carte em atendimento às Secretarias e Órgãos da Administração Direta da Prefeitura Municipal de Uberlândia.,"Secretaria Municipal de Prevenção as Drogas, Defesa Social e Defesa Civil",Qual o valor gasto com futuro ou eventual fornecimento de refeições a la carte em atendimento às Secretarias e Órgãos da Administração Direta da Prefeitura Municipal de Uberlândia.,,,,,,Prefeitura Municipal de Uberlândia
27419 - 2014,20/02/2015,5 - PREGÃO PRESENCIAL,903,NUTRIR REFEICOES COLETIVAS LTDA - EPP,3120,"futuro ou eventual fornecimento de refeições, em atendimento às Secretarias e aos Órgãos da Administração Direta da Prefeitura Municipal de Uberlândia.","Secretaria Municipal de Prevenção as Drogas, Defesa Social e Defesa Civil","Qual o valor gasto com futuro ou eventual fornecimento de refeições, em atendimento às Secretarias e aos Órgãos da Administração Direta da Prefeitura Municipal de Uberlândia.",,,,,,Prefeitura Municipal de Uberlândia
11638 - 2015,28/08/2015,5 - PREGÃO PRESENCIAL,197,DOMINIUM INFORMATICA LTDA,18000,futura ou eventual locação de equipamentos de informática (microcomputadores e outros) em atendimento às Secretarias e aos Órgãos da Administração DIreta da Prefeitura Municipal de Uberlândia,"Secretaria Municipal de Prevenção as Drogas, Defesa Social e Defesa Civil",Qual o valor gasto com futura ou eventual locação de equipamentos de informática (microcomputadores e outros) em atendimento às Secretarias e aos Órgãos da Administração DIreta da Prefeitura Municipal de Uberlândia,,,,,,Prefeitura Municipal de Uberlândia
28554 - 2014,13/03/2015,5 - PREGÃO PRESENCIAL,942,COMERCIAL ELETRO - EIRELI - EPP,88920,"fornecimento de gêneros alimentícios (bolacha maisena e bolacha água e sal), em atendimento a Secretaria Municipal Antidrogas e de Defesa Social.","Secretaria Municipal de Prevenção as Drogas, Defesa Social e Defesa Civil","Qual o valor gasto com fornecimento de gêneros alimentícios (bolacha maisena e bolacha água e sal), em atendimento a Secretaria Municipal Antidrogas e de Defesa Social.",,,,,,Prefeitura Municipal de Uberlândia
1132 - 2015,05/05/2015,5 - PREGÃO PRESENCIAL,3,COOPERATIVA AGROPECUARIA LTDA DE UBERLANDIA,3066,"futura ou eventual fornecimento de leite e manteiga, em atendimento às Secretarias e aos Órgãos da Administração Direta da Prefeitura Municipal de Uberlândua.","Secretaria Municipal de Prevenção as Drogas, Defesa Social e Defesa Civil","Qual o valor gasto com futura ou eventual fornecimento de leite e manteiga, em atendimento às Secretarias e aos Órgãos da Administração Direta da Prefeitura Municipal de Uberlândia.",,,,,,Prefeitura Municipal de Uberlândia
16444 - 2015,11/12/2015,5 - PREGÃO PRESENCIAL,332,MINAS MAIS PRODUTOS ALIMENTICIOS E SERVICOS LTDA - EPP,107250,"futuro ou eventual fornecimento de lanches, em atendimento às Secretarias e aos Órgãos da Administração Direta da Prefeitura Municipal de Uberlândia.","Secretaria Municipal de Prevenção as Drogas, Defesa Social e Defesa Civil","Qual o valor gasto com futuro ou eventual fornecimento de lanches, em atendimento às Secretarias e aos Órgãos da Administração Direta da Prefeitura Municipal de Uberlândia.",,,,,,Prefeitura Municipal de Uberlândia
26065 - 2013,17/06/2014,5 - PREGÃO PRESENCIAL,1140,WESI COMERCIAL LTDA - EPP,75.2,"aquisição de materiais de escritório (agenda, almofada para carimbo, apontados de lápis, caneta, etc), em atendimento à Secretarias e aos Órgãos da Administração Direta da Prefeitura Municipal de Uberlândia","Secretaria Municipal de Prevenção as Drogas, Defesa Social e Defesa Civil","Qual o valor gasto com aquisição de materiais de escritório (agenda, almofada para carimbo, apontados de lápis, caneta, etc), em atendimento à Secretarias e aos Órgãos da Administração Direta da Prefeitura Municipal de Uberlândia",,,,,,Prefeitura Municipal de Uberlândia
26065 - 2013,17/06/2014,5 - PREGÃO PRESENCIAL,1140,COMERCIAL GRANADA MATERIAIS DE ESCRITORIO LTDA - EPP,332.8,"aquisição de materiais de escritório (agenda, almofada para carimbo, apontados de lápis, caneta, etc), em atendimento à Secretarias e aos Órgãos da Administração Direta da Prefeitura Municipal de Uberlândia","Secretaria Municipal de Prevenção as Drogas, Defesa Social e Defesa Civil","Qual o valor gasto com aquisição de materiais de escritório (agenda, almofada para carimbo, apontados de lápis, caneta, etc), em atendimento à Secretarias e aos Órgãos da Administração Direta da Prefeitura Municipal de Uberlândia",,,,,,Prefeitura Municipal de Uberlândia
20399 - 2015,18/12/2015,5 - PREGÃO PRESENCIAL,474,ATITUDE COMERCIAL EIRELI - ME,11466,"futuro e eventual fornecimento de materiais esportivos, em atendimento às Secretarias e aos Órgãos da Administração Direta da Prefeitura Municipal de Uberlândia.","Secretaria Municipal de Prevenção as Drogas, Defesa Social e Defesa Civil","Qual o valor gasto com futuro e eventual fornecimento de materiais esportivos, em atendimento às Secretarias e aos Órgãos da Administração Direta da Prefeitura Municipal de Uberlândia.",,,,,,Prefeitura Municipal de Uberlândia
27723 - 2014,27/01/2015,5 - PREGÃO PRESENCIAL,911,OLIVEIRA & LOURENCO INDUSTRIA DE PANIFICACAO LTDA - ME,8000,"futuro e eventual fornecimento de pães, em atendimento às Secretarias e Órgãos da Administração Direta da Prefeitura Municipal de Uberlândia.","Secretaria Municipal de Prevenção as Drogas, Defesa Social e Defesa Civil","Qual o valor gasto com futuro e eventual fornecimento de pães, em atendimento às Secretarias e Órgãos da Administração Direta da Prefeitura Municipal de Uberlândia.",,,,,,Prefeitura Municipal de Uberlândia
20399 - 2015,18/12/2015,5 - PREGÃO PRESENCIAL,474,LM COMERCIO LTDA - ME,9187.78,"futuro e eventual fornecimento de materiais esportivos, em atendimento às Secretarias e aos Órgãos da Administração Direta da Prefeitura Municipal de Uberlândia.","Secretaria Municipal de Prevenção as Drogas, Defesa Social e Defesa Civil","Qual o valor gasto com futuro e eventual fornecimento de materiais esportivos, em atendimento às Secretarias e aos Órgãos da Administração Direta da Prefeitura Municipal de Uberlândia.",,,,,,Prefeitura Municipal de Uberlândia
26065 - 2013,17/06/2014,5 - PREGÃO PRESENCIAL,1140,OPCAO PAPEIS COMERCIO LTDA - ME,41.84,"aquisição de materiais de escritório (agenda, almofada para carimbo, apontados de lápis, caneta, etc), em atendimento à Secretarias e aos Órgãos da Administração Direta da Prefeitura Municipal de Uberlândia","Secretaria Municipal de Prevenção as Drogas, Defesa Social e Defesa Civil","Qual o valor gasto com aquisição de materiais de escritório (agenda, almofada para carimbo, apontados de lápis, caneta, etc), em atendimento à Secretarias e aos Órgãos da Administração Direta da Prefeitura Municipal de Uberlândia",,,,,,Prefeitura Municipal de Uberlândia
31123 - 2014,09/04/2015,5 - PREGÃO PRESENCIAL,1034,DIEGO ALBERTO RAMOS RAFAEL - ME,6756,futura ou eventual fornecimento de produtos para coffee break em atendimento às Secretarias e Órgãos da Administração Direta da Prefeitura Municipal de Uberlândia.,"Secretaria Municipal de Prevenção as Drogas, Defesa Social e Defesa Civil",Qual o valor gasto com futura ou eventual fornecimento de produtos para coffee break em atendimento às Secretarias e Órgãos da Administração Direta da Prefeitura Municipal de Uberlândia.,,,,,,Prefeitura Municipal de Uberlândia
26065 - 2013,17/06/2014,5 - PREGÃO PRESENCIAL,1140,NASCUCAR INDUSTRIA E COMERCIO LTDA - EPP,34.2,"aquisição de materiais de escritório (agenda, almofada para carimbo, apontados de lápis, caneta, etc), em atendimento à Secretarias e aos Órgãos da Administração Direta da Prefeitura Municipal de Uberlândia","Secretaria Municipal de Prevenção as Drogas, Defesa Social e Defesa Civil","Qual o valor gasto com aquisição de materiais de escritório (agenda, almofada para carimbo, apontados de lápis, caneta, etc), em atendimento à Secretarias e aos Órgãos da Administração Direta da Prefeitura Municipal de Uberlândia",,,,,,Prefeitura Municipal de Uberlândia
26065 - 2013,17/06/2014,5 - PREGÃO PRESENCIAL,1140,COMERCIAL LORENA LTDA - EPP,145,"aquisição de materiais de escritório (agenda, almofada para carimbo, apontados de lápis, caneta, etc), em atendimento à Secretarias e aos Órgãos da Administração Direta da Prefeitura Municipal de Uberlândia","Secretaria Municipal de Prevenção as Drogas, Defesa Social e Defesa Civil","Qual o valor gasto com aquisição de materiais de escritório (agenda, almofada para carimbo, apontados de lápis, caneta, etc), em atendimento à Secretarias e aos Órgãos da Administração Direta da Prefeitura Municipal de Uberlândia",,,,,,Prefeitura Municipal de Uberlândia
30463 - 2014,1/12/2015,5 - PREGÃO PRESENCIAL,1010,COMERCIAL GRANADA MATERIAIS DE ESCRITORIO LTDA - EPP,433.2,"futuro ou e eventual fornecimento de materiais de escritório (agenda, almofada para carimbo, apontador de lapis, caneta etc), em atendimento ás Secretarias e aos Órgãos da Administração Direta da Prefeitura Municipal de Uberlândia.",Procuradoria Geral do Muninípio,"Qual o valor gasto com futuro ou e eventual fornecimento de materiais de escritório (agenda, almofada para carimbo, apontador de lapis, caneta etc), em atendimento ás Secretarias e aos Órgãos da Administração Direta da Prefeitura Municipal de Uberlândia.",,,,,,Prefeitura Municipal de Uberlândia
30463 - 2014,1/12/2015,5 - PREGÃO PRESENCIAL,1010,COMERCIAL LORENA LTDA - EPP,35,"futuro ou e eventual fornecimento de materiais de escritório (agenda, almofada para carimbo, apontador de lapis, caneta etc), em atendimento ás Secretarias e aos Órgãos da Administração Direta da Prefeitura Municipal de Uberlândia.",Procuradoria Geral do Muninípio,"Qual o valor gasto com futuro ou e eventual fornecimento de materiais de escritório (agenda, almofada para carimbo, apontador de lapis, caneta etc), em atendimento ás Secretarias e aos Órgãos da Administração Direta da Prefeitura Municipal de Uberlândia.",,,,,,Prefeitura Municipal de Uberlândia
30463 - 2014,1/12/2015,5 - PREGÃO PRESENCIAL,1010,NASCUCAR INDUSTRIA E COMERCIO LTDA - EPP,67.6,"futuro ou e eventual fornecimento de materiais de escritório (agenda, almofada para carimbo, apontador de lapis, caneta etc), em atendimento ás Secretarias e aos Órgãos da Administração Direta da Prefeitura Municipal de Uberlândia.",Procuradoria Geral do Muninípio,"Qual o valor gasto com futuro ou e eventual fornecimento de materiais de escritório (agenda, almofada para carimbo, apontador de lapis, caneta etc), em atendimento ás Secretarias e aos Órgãos da Administração Direta da Prefeitura Municipal de Uberlândia.",,,,,,Prefeitura Municipal de Uberlândia
30463 - 2014,1/12/2015,5 - PREGÃO PRESENCIAL,1010,OPCAO PAPEIS COMERCIO LTDA - ME,3116.42,"futuro ou e eventual fornecimento de materiais de escritório (agenda, almofada para carimbo, apontador de lapis, caneta etc), em atendimento ás Secretarias e aos Órgãos da Administração Direta da Prefeitura Municipal de Uberlândia.",Procuradoria Geral do Muninípio,"Qual o valor gasto com futuro ou e eventual fornecimento de materiais de escritório (agenda, almofada para carimbo, apontador de lapis, caneta etc), em atendimento ás Secretarias e aos Órgãos da Administração Direta da Prefeitura Municipal de Uberlândia.",,,,,,Prefeitura Municipal de Uberlândia
30463 - 2014,1/12/2015,5 - PREGÃO PRESENCIAL,1010,ME COMERCIAL EIRELI,516.17,"futuro ou e eventual fornecimento de materiais de escritório (agenda, almofada para carimbo, apontador de lapis, caneta etc), em atendimento ás Secretarias e aos Órgãos da Administração Direta da Prefeitura Municipal de Uberlândia.",Procuradoria Geral do Muninípio,"Qual o valor gasto com futuro ou e eventual fornecimento de materiais de escritório (agenda, almofada para carimbo, apontador de lapis, caneta etc), em atendimento ás Secretarias e aos Órgãos da Administração Direta da Prefeitura Municipal de Uberlândia.",,,,,,Prefeitura Municipal de Uberlândia
30463 - 2014,1/12/2015,5 - PREGÃO PRESENCIAL,1010,MIDIAPEL PAPELARIA E INFORMATICA LTDA - ME,32,"futuro ou e eventual fornecimento de materiais de escritório (agenda, almofada para carimbo, apontador de lapis, caneta etc), em atendimento ás Secretarias e aos Órgãos da Administração Direta da Prefeitura Municipal de Uberlândia.",Procuradoria Geral do Muninípio,"Qual o valor gasto com futuro ou e eventual fornecimento de materiais de escritório (agenda, almofada para carimbo, apontador de lapis, caneta etc), em atendimento ás Secretarias e aos Órgãos da Administração Direta da Prefeitura Municipal de Uberlândia.",,,,,,Prefeitura Municipal de Uberlândia
26878 - 2015,5/2/2016,1 - CONVITE,728,MECATRON TECNICA LTDA - ME,4268.33,"prestação de serviços de assistência técnica com manutenção preventiva e corretiva em máquina de escrever, com fornecimento de peças, em atendimento à Procuradoria Geral do Município.",Procuradoria Geral do Muninípio,"Qual o valor gasto com prestação de serviços de assistência técnica com manutenção preventiva e corretiva em máquina de escrever, com fornecimento de peças, em atendimento à Procuradoria Geral do Município.",,,,,,Prefeitura Municipal de Uberlândia
28701 - 2015,12/5/2016,5 - PREGÃO PRESENCIAL,833,ALINE EDITORA E ARTES GRAFICAS LTDA,9910,"prestação de serviços de encadernação e restauração de livros, em atendimento a Procuradoria Geral do Município.",Procuradoria Geral do Muninípio,"Qual o valor gasto com prestação de serviços de encadernação e restauração de livros, em atendimento a Procuradoria Geral do Município.",,,,,,Prefeitura Municipal de Uberlândia
29656 - 2015,5/2/2016,1 - CONVITE,860,ALERIANO ROSA DA SILVA - CPF 051.169.526-81 - ME,700,"aquisição de carimbos e troca de borracha para carimbo, em atendimento à Procuradoria Geral do Município.",Procuradoria Geral do Muninípio,"Qual o valor gasto com aquisição de carimbos e troca de borracha para carimbo, em atendimento à Procuradoria Geral do Município.",,,,,,Prefeitura Municipal de Uberlândia
