15242 - 2015,24/07/2015,1 - CONVITE,300,CONSTRU VIDRO COMERCIO E SERVICOS LTDA - ME,19900,"execução dos serviços de restauração e revitalização da Casa da Cultura, situada na Praça Coronel Carneiro, esquina com a Rua XV de Novembro, n.° 86, Bairro Fundinho, com fornecimento de material, mão de obra e estrutura, através da S.M. de Cultura.",Secretaria Municipal de Cultura,"Qual o valor gasto com execução dos serviços de restauração e revitalização da Casa da Cultura, situada na Praça Coronel Carneiro, esquina com a Rua XV de Novembro, n.° 86, Bairro Fundinho, com fornecimento de material, mão de obra e estrutura, através da S.M. de Cultura.",LUIS CARLOS MAIA MORETTI JUNIOR EVENTOS,10350,,,TFF CONSTRUCOES E MONTAGENS LTDA,Prefeitura Municipal de Uberlândia
19199 - 2015,30/09/2015,6 - PREGÃO ELETRÔNICO,415,ANDAIMES MONTAGENS E EVENTOS LTDA - ME,12800,"locação, montagem e desmontagem de arquibancada, em atendimento á Secretaria Municipal de Cultura.",Secretaria Municipal de Cultura,"Qual o valor gasto com locação, montagem e desmontagem de arquibancada, em atendimento á Secretaria Municipal de Cultura.",LUKAUTO-COMERCIO DE PNEUMATICOS E PECAS LTDA-EPP,121770.5,,,THASSIA CAMILA DE ALMEIDA SOARES,Prefeitura Municipal de Uberlândia
30217 - 2014,02/02/2015,5 - PREGÃO PRESENCIAL,1006,C.B.S SONORIZACAO EIRELI,833000,"prestação de serviços para realização do Carnaval/2015, com fornecimeto de toda a estrutura, equipamentos, materiais e mão de obra (inclusive serviço de vigilância desarmada e brigadista), em atendimento a Secretaria Municipal de Cultura.",Secretaria Municipal de Cultura,"Qual o valor gasto com prestação de serviços para realização do Carnaval/2015, com fornecimeto de toda a estrutura, equipamentos, materiais e mão de obra (inclusive serviço de vigilância desarmada e brigadista), em atendimento a Secretaria Municipal de Cultura.",LUMAR COMERCIO DE PRODUTOS FARMACEUTICOS LTDA,6123.6,,,TMG TURISMO LTDA - ME,Prefeitura Municipal de Uberlândia
23975 - 2015,06/11/2015,1 - CONVITE,622,ENGEPAC ENGENHARIA LTDA - EPP,4045.31,"Construção de Estrutura para implantação da Escultura do ""Anjo Congadeiro"" (base 2,30 (altura) x 0,50 (largura) x 0,50 (comprimento)), em atendimento à Secretaria Municipal de Cultura.",Secretaria Municipal de Cultura,"Qual o valor gasto com Construção de Estrutura para implantação da Escultura do ""Anjo Congadeiro"" (base 2,30 (altura) x 0,50 (largura) x 0,50 (comprimento)), em atendimento à Secretaria Municipal de Cultura.",LYNX ELEVADORES LTDA-ME,7515,,,TORNEADORA GALVAO LTDA,Prefeitura Municipal de Uberlândia
1132 - 2015,05/05/2015,5 - PREGÃO PRESENCIAL,3,COOPERATIVA AGROPECUARIA LTDA DE UBERLANDIA,12584,"futura ou eventual fornecimento de leite e manteiga, em atendimento às Secretarias e aos Órgãos da Administração Direta da Prefeitura Municipal de Uberlândua.",Secretaria Municipal de Cultura,"Qual o valor gasto com futura ou eventual fornecimento de leite e manteiga, em atendimento às Secretarias e aos Órgãos da Administração Direta da Prefeitura Municipal de Uberlândia.",M & A EMPREITEIRA LTDA - ME,114249.9,,,UBER MEDICA E HOSPITALAR LTDA - EPP,Prefeitura Municipal de Uberlândia
28357 - 2014,12/05/2015,6 - PREGÃO ELETRÔNICO,934,LIFEMED IND DE EQUIP E ARTIGOS MEDICOS HOSPITALARES S A,54000,"aquisição de equipamentos hospitalares, em atendimento a Secretaria Municipal de Saúde.",Secretaria Municipal de Saúde,"Qual o valor gasto com aquisição de equipamentos hospitalares, em atendimento a Secretaria Municipal de Saúde.",M P O VENTURA EPP,21310,,,UDI TRATORES COMERCIO DE PECAS E SERVICOS LTDA - ME,Prefeitura Municipal de Uberlândia
4577 - 2015,29/07/2015,5 - PREGÃO PRESENCIAL,83,LICITAR COMERCIO E NEGOCIOS GOVERNAMENTAIS LTDA - ME,49000,"aquisição de biscoitos salgados, em atendimento á Secretaria Municipal de Sáude.",Secretaria Municipal de Saúde,"Qual o valor gasto com aquisição de biscoitos salgados, em atendimento á Secretaria Municipal de Sáude.",M2 SOM E LUZ LTDA - ME,54930,,,V L COMERCIO DE BRINDES PROMOCIONAIS LTDA - ME,Prefeitura Municipal de Uberlândia
31122 - 2014,06/04/2015,5 - PREGÃO PRESENCIAL,1033,EPS EMPREENDIMENTOS S/A,5970,"futura ou eventual contratação de empresa especializada na prestação de serviços de hospedagem, em atendimento às Secretarias e aos Órgãos da Administração Direta da Prefeitura Municipal de Uberlândia.",Secretaria Municipal de Saúde,"Qual o valor gasto com futura ou eventual contratação de empresa especializada na prestação de serviços de hospedagem, em atendimento às Secretarias e aos Órgãos da Administração Direta da Prefeitura Municipal de Uberlândia.",M7 TECIDOS E ACESSORIOS LTDA - EPP,70935,,,V S INDUSTRIA E COMERCIO DE CONFECCOES LTDA-EPP,Prefeitura Municipal de Uberlândia
7507 - 2015,11/06/2015,5 - PREGÃO PRESENCIAL,152,PLOTTER LUMINOSOS LTDA - ME,6340,aquisição e confecção de materiais (placa em ferro galvanizado e confecção de totem) em atendimento a Secretaria Municipal de Saúde.,Secretaria Municipal de Saúde,Qual o valor gasto com aquisição e confecção de materiais (placa em ferro galvanizado e confecção de totem) em atendimento a Secretaria Municipal de Saúde.,MAAP COMERCIO DE MOVEIS PARA ESCRITORIO EIRELI-EPP,103306.5,,,VAN DERVELD E CIA LTDA- ME,Prefeitura Municipal de Uberlândia
11852 - 2015,29/07/2015,6 - PREGÃO ELETRÔNICO,198,IMPACTRON SERVICE LTDA-EPP,66570,"seleção e contratação de empresa para aquisiçao de equipamentos de informática, em atendimento á Secretaria Municipal de Saúde.",Secretaria Municipal de Saúde,"Qual o valor gasto com seleção e contratação de empresa para aquisiçao de equipamentos de informática, em atendimento á Secretaria Municipal de Saúde.",MADEIREIRA AIMORE EIRELI - EPP,9535.59,,,VEREDA ENGENHARIA LTDA,Prefeitura Municipal de Uberlândia
18212 - 2015,09/10/2015,6 - PREGÃO ELETRÔNICO,382,K C R S COMERCIODE EQUIPAMENTOS EIRELI-EPP,4490,"aquisição de equipamento, em atendimento à Secretaria Municipal de Saúde.",Secretaria Municipal de Saúde,"Qual o valor gasto com aquisição de equipamento, em atendimento à Secretaria Municipal de Saúde.",MADEIREIRA REI DE MINAS EIRELI - EPP,238300.8,,,VIA NOVITA LTDA - ME,Prefeitura Municipal de Uberlândia
2186 - 2015,18/08/2015,6 - PREGÃO ELETRÔNICO,16,PLANO A COMERCIO E SERVICOS LTDA - ME,5710,"aquisição de mobiliário, em atendimento à Secretaria Municipal de Saúde.",Secretaria Municipal de Saúde,"Qual o valor gasto com aquisição de mobiliário, em atendimento à Secretaria Municipal de Saúde.",MAGAZIN PARIS VIDA AO VIVO LTDA-EPP,2467.06,,,VIRGINIA ANDREA DE OLIVEIRA CECCONI - EPP,Prefeitura Municipal de Uberlândia
29570 - 2014,09/02/2015,6 - PREGÃO ELETRÔNICO,973,CIRURGICA ZANIN LTDA - EPP,26567,"aquisição de equipamentos (detector de batimentos cardíacos e aspirador portátil), em atendimento à Secretaria Municipal de Saúde.",Secretaria Municipal de Saúde,"Qual o valor gasto com aquisição de equipamentos (detector de batimentos cardíacos e aspirador portátil), em atendimento à Secretaria Municipal de Saúde.",MAMEDE EVENTOSE ENTRETERIMENTO LTDA-ME,34000.66,,,VIVEIRO ECOLOGICO DONA EUZEBIA LTDA - EPP,Prefeitura Municipal de Uberlândia
12466 - 2015,28/05/2015,1 - CONVITE,214,MILLENIUM SERVICOS COMERCIO E DISTRIBUICAO LTDA - ME,6422,"confecção de camisetas brancas, com mangas coloridas (tecido 100% poliéster branco, gola careca, sublimação na grente e nas costas de tamnhos no máximo 20x13cm) em atendimento a Secretaria Municipal de Saúde.",Secretaria Municipal de Saúde,"Qual o valor gasto com confecção de camisetas brancas, com mangas coloridas (tecido 100% poliéster branco, gola careca, sublimação na grente e nas costas de tamnhos no máximo 20x13cm) em atendimento a Secretaria Municipal de Saúde.",MANJATO TRATORES LTDA - EPP,21820,,,WEM EQUIPAMENTOS ELETRONICOS LTDA,Prefeitura Municipal de Uberlândia
18547 - 2015,14/10/2015,6 - PREGÃO ELETRÔNICO,390,VDM EQUIPAMENTOS DE SEGURANCA E UNIFORMES LTDA,29015,"aquisição de Filtro para máscara facial inteira para respirador de ar tipo peça facial inteira (compativel com C.A 5758), em atendimento à Secretaria Municipal de Saúde.",Secretaria Municipal de Saúde,"Qual o valor gasto com aquisição de Filtro para máscara facial inteira para respirador de ar tipo peça facial inteira (compativel com C.A 5758), em atendimento à Secretaria Municipal de Saúde.",MAPFRE SEGUROS GERAIS S A,39990,,,WENDEL COSTA RODRIGUES EIRELI - ME,Prefeitura Municipal de Uberlândia
18215 - 2015,13/11/2015,6 - PREGÃO ELETRÔNICO,385,SAUDE E COMPANHIA DISTRIBUIDORA LTDA - EPP,4552.08,"aquisição de materiais hospitalares (termometro digital e data logger), em atendimento à Secretaria Municipal de Saúde.",Secretaria Municipal de Saúde,"Qual o valor gasto com aquisição de materiais hospitalares (termometro digital e data logger), em atendimento à Secretaria Municipal de Saúde.",MAQNETE COMERCIO E SERVICOS EIRELI-ME,8556.56,,,WHITE MARTINS GASES INDUSTRIAIS LTDA,Prefeitura Municipal de Uberlândia
31123 - 2014,09/04/2015,5 - PREGÃO PRESENCIAL,1034,DIEGO ALBERTO RAMOS RAFAEL - ME,296.8,futura ou eventual fornecimento de produtos para coffee break em atendimento às Secretarias e Órgãos da Administração Direta da Prefeitura Municipal de Uberlândia.,Secretaria Municipal de Saúde,Qual o valor gasto com futura ou eventual fornecimento de produtos para coffee break em atendimento às Secretarias e Órgãos da Administração Direta da Prefeitura Municipal de Uberlândia.,MARCA D'AGUA LTDA - ME,39704.75,,,XULABEIKA MUDAS FRUTIFERAS E ORNAMENTAIS LTDA ME,Prefeitura Municipal de Uberlândia
15091 - 2014,17/09/2015,6 - PREGÃO ELETRÔNICO,505,VIRGINIA ANDREA DE OLIVEIRA CECCONI - EPP,124.5,"aquisição do mobiliário para serem utilizados pela Saúde Mental - CAPS II e III, através da Secretaria Municipal de Saúde.",Secretaria Municipal de Saúde,"Qual o valor gasto com aquisição do mobiliário para serem utilizados pela Saúde Mental - CAPS II e III, através da Secretaria Municipal de Saúde.",MARCELA PERIM DE MORAES LUCINDO - ME,39630,,,ZAFALON SOLUCOES HOSPITALARES LTDA,Prefeitura Municipal de Uberlândia
31624 - 2014,02/03/2015,5 - PREGÃO PRESENCIAL,1055,CURINGA VEICULOS LTDA,30600,"aquisição de veículo novo, em atendimento à Secretaria Municipal de Saúde.",Secretaria Municipal de Saúde,"Qual o valor gasto com aquisição de veículo novo, em atendimento à Secretaria Municipal de Saúde.",MARCOLINO & MARCOLINO BRINDES E ETIQUETAS LTDA - ME,2795,,,ZILLION COMERCIO & REPRESENTACOES LTDA,Prefeitura Municipal de Uberlândia
26153 - 2014,19/02/2015,6 - PREGÃO ELETRÔNICO,843,PLANALMED PRODUTOS PARA HOSPITAIS E LABORATORIOS LTDA - ME,3200,"aquisição de materiais diversos para serem utilizados pelo Laboratório de Controle de Qualidade em Saúde - LCQS, em atendimento à Secretaria Municipal de Saúde.",Secretaria Municipal de Saúde,"Qual o valor gasto com aquisição de materiais diversos para serem utilizados pelo Laboratório de Controle de Qualidade em Saúde - LCQS, em atendimento à Secretaria Municipal de Saúde.",MARIA DA APARECIDA FARIA SOARES - CPF 572 952 716-00-EPP,45000,,,,Prefeitura Municipal de Uberlândia
30065 - 2014,01/09/2015,6 - PREGÃO ELETRÔNICO,997,IBI LIFE MEDICAL LTDA - ME,27898,"aquisição de Equipamentos Hospitalares (COLPOSCÓPIO BINOCULAR E OUTROS), em atendimento à Secretaria Municípal de Saúde.",Secretaria Municipal de Saúde,"Qual o valor gasto com aquisição de Equipamentos Hospitalares (COLPOSCÓPIO BINOCULAR E OUTROS), em atendimento à Secretaria Municípal de Saúde.",MARIA DIVINA DA SILVA,17280,,,,Prefeitura Municipal de Uberlândia
11852 - 2015,29/07/2015,6 - PREGÃO ELETRÔNICO,198,PLANO A COMERCIO E SERVICOS LTDA - ME,12300,"seleção e contratação de empresa para aquisiçao de equipamentos de informática, em atendimento á Secretaria Municipal de Saúde.",Secretaria Municipal de Saúde,"Qual o valor gasto com seleção e contratação de empresa para aquisiçao de equipamentos de informática, em atendimento á Secretaria Municipal de Saúde.",MARIA HELENA DE ARAUJO 06513142830,4885,,,,Prefeitura Municipal de Uberlândia
21557 - 2015,03/12/2015,6 - PREGÃO ELETRÔNICO,524,COLDLAB INDUSTRIA COMERCIO E ASSISTENCIA TECNICA LTDA-ME,63770,"aquisição de equipamento, em atendimento á Secretaria Municipal de Saúde.",Secretaria Municipal de Saúde,"Qual o valor gasto com aquisição de equipamento, em atendimento á Secretaria Municipal de Saúde.",MAXICROM INDUSTRIA GRAFICA LTDA - EPP,34576.5,,,,Prefeitura Municipal de Uberlândia
30639 - 2014,10/06/2015,6 - PREGÃO ELETRÔNICO,1015,NELIO PAULINO LINS PRODUTOS HOSPITALARES- ME,55000,"aquisição de equipamentos hospitalares, em atendimento á Secretaria Municipal de Saúde.",Secretaria Municipal de Saúde,"Qual o valor gasto com aquisição de equipamentos hospitalares, em atendimento á Secretaria Municipal de Saúde.",MB PRE FABRICADOS LTDA - EPP,24500,,,,Prefeitura Municipal de Uberlândia
8960 - 2015,23/10/2015,6 - PREGÃO ELETRÔNICO,166,NOVO SECULO MOVEIS PARA ESCRITORIO LTDA - EPP,7375,"aquisição de materiais diversos (estante de aço, ventilador, mesa, armário, etc), em atendimento á Secretaria Municipal de Saúde.",Secretaria Municipal de Saúde,"Qual o valor gasto com aquisição de materiais diversos (estante de aço, ventilador, mesa, armário, etc), em atendimento á Secretaria Municipal de Saúde.",ME COMERCIAL EIRELI,810124.27,,,,Prefeitura Municipal de Uberlândia
2186 - 2015,18/08/2015,6 - PREGÃO ELETRÔNICO,16,NOVO SECULO MOVEIS PARA ESCRITORIO LTDA - EPP,4549.1,"aquisição de mobiliário, em atendimento à Secretaria Municipal de Saúde.",Secretaria Municipal de Saúde,"Qual o valor gasto com aquisição de mobiliário, em atendimento à Secretaria Municipal de Saúde.",MECA OFFICE MOBILIARIO EIRELI,208512.03,,,,Prefeitura Municipal de Uberlândia
7282 - 2015,25/11/2015,5 - PREGÃO PRESENCIAL,146,LICITAR COMERCIO E NEGOCIOS GOVERNAMENTAIS LTDA - ME,10532.7,"aquisição de peças de manutenção dos atomizadores costais motorizados TEX - 54 da marca Guarany, em atendimento à Secretaria Municipal de Saúde.",Secretaria Municipal de Saúde,"Qual o valor gasto com aquisição de peças de manutenção dos atomizadores costais motorizados TEX - 54 da marca Guarany, em atendimento à Secretaria Municipal de Saúde.",MECATRON TECNICA LTDA - ME,7423.33,,,,Prefeitura Municipal de Uberlândia
27844 - 2014,10/09/2014,5 - PREGÃO PRESENCIAL,915,TRADE MARKETING HOTEIS TURISMO E EVENTOS LTDA,85000,"futura e eventual prestação de serviços de reserva, emissão, marcação, reemissão, cancelamento e reembolso de bilhetes de passagens aéreas nacionais e internacionais, em atendimento às Secretarias e Órgãos da Administração Direta da PMU.",Secretaria Municipal de Saúde,"Qual o valor gasto com futura e eventual prestação de serviços de reserva, emissão, marcação, reemissão, cancelamento e reembolso de bilhetes de passagens aéreas nacionais e internacionais, em atendimento às Secretarias e Órgãos da Administração Direta da PMU.",MEDIC VET LTDA - EPP,8694,,,,Prefeitura Municipal de Uberlândia
27723 - 2014,27/01/2015,5 - PREGÃO PRESENCIAL,911,OLIVEIRA & LOURENCO INDUSTRIA DE PANIFICACAO LTDA - ME,894944,"futuro e eventual fornecimento de pães, em atendimento às Secretarias e Órgãos da Administração Direta da Prefeitura Municipal de Uberlândia.",Secretaria Municipal de Saúde,"Qual o valor gasto com futuro e eventual fornecimento de pães, em atendimento às Secretarias e Órgãos da Administração Direta da Prefeitura Municipal de Uberlândia.",MEDICINALI PRODUTOS PARA SAUDE EIRELI ME,35399.52,,,,Prefeitura Municipal de Uberlândia
2186 - 2015,18/08/2015,6 - PREGÃO ELETRÔNICO,16,MECA OFFICE MOBILIARIO EIRELI,23966.95,"aquisição de mobiliário, em atendimento à Secretaria Municipal de Saúde.",Secretaria Municipal de Saúde,"Qual o valor gasto com aquisição de mobiliário, em atendimento à Secretaria Municipal de Saúde.",MEDTEC - SUPRIMENTOS MEDICO HOSPITALARES LTDA - EPP,106845,,,,Prefeitura Municipal de Uberlândia
22698 - 2014,09/06/2015,6 - PREGÃO ELETRÔNICO,734,COMIGO COMERCIAL MINAS GOIAS LTDA - EPP,8985.5,"aquisição de aparelhos domésticos, em atendimento às Secretarias Municipais de Gestão Estratégica, Ciência e Tecnologia e de Saúde.",Secretaria Municipal de Saúde,"Qual o valor gasto com aquisição de aparelhos domésticos, em atendimento às Secretarias Municipais de Gestão Estratégica, Ciência e Tecnologia e de Saúde.",MENDONCA & FERNANDES LTDA -ME,4216,,,,Prefeitura Municipal de Uberlândia
13888 - 2015,19/08/2015,5 - PREGÃO PRESENCIAL,259,COPAGAZ DISTRIBUIDORA DE GAS S.A,33840,"fornecimento de gás GLP (de cozinha), em atendimento às Secretarias e aos Órgãos da Administração Direta da Prefeitura Municipal de Uberlândia.",Secretaria Municipal de Saúde,"Qual o valor gasto com fornecimento de gás GLP (de cozinha), em atendimento às Secretarias e aos Órgãos da Administração Direta da Prefeitura Municipal de Uberlândia.",MICRON GENEROS ALIMENTICIOS EIRELI EPP,19032,,,,Prefeitura Municipal de Uberlândia
19952 - 2015,18/09/2015,1 - CONVITE,451,NOROESTE COMERCIAL DE SUPRIMENTOS LTDA - ME,3000,"aquisição de inseticida piretroide e isca moluscicida, a serem utilizados no programa de controle de agravos e roedores do Centro de Controle de Zoonoses, em atendimento à Secretaria Municipal de Saúde.",Secretaria Municipal de Saúde,"Qual o valor gasto com aquisição de inseticida piretroide e isca moluscicida, a serem utilizados no programa de controle de agravos e roedores do Centro de Controle de Zoonoses, em atendimento à Secretaria Municipal de Saúde.",MIDIAPEL PAPELARIA E INFORMATICA LTDA - ME,281017.5,,,,Prefeitura Municipal de Uberlândia
4379 - 2015,18/08/2015,6 - PREGÃO ELETRÔNICO,76,TARTANHA PROGRESS LTDA-ME,13607,"futura ou eventual aquisição de materiais diversos (fita métrica plástica, bandeja lisa sem tampa, balde, bacia e outros), em atendimento à Secretaria Municipal de Saúde.",Secretaria Municipal de Saúde,"Qual o valor gasto com futura ou eventual aquisição de materiais diversos (fita métrica plástica, bandeja lisa sem tampa, balde, bacia e outros), em atendimento à Secretaria Municipal de Saúde.",MILENIUM TRANSPORTES LTDA - EPP,6650,,,,Prefeitura Municipal de Uberlândia
18340 - 2015,15/12/2015,6 - PREGÃO ELETRÔNICO,386,FUSYON PRIME COMERCIO DE MERCADORIAS E SERVICOS LTDA-ME,7555.32,"aquisição de mobiliários (arquivo de aço, cadeira universitária, mesa tipo secretária e outros), em atendimento à Secretaria Municipal de Saúde.",Secretaria Municipal de Saúde,"Qual o valor gasto com aquisição de mobiliários (arquivo de aço, cadeira universitária, mesa tipo secretária e outros), em atendimento à Secretaria Municipal de Saúde.",MILLENIUM SERVICOS COMERCIO E DISTRIBUICAO LTDA - ME,205946,,,,Prefeitura Municipal de Uberlândia
15091 - 2014,17/09/2015,6 - PREGÃO ELETRÔNICO,505,NOVO SECULO MOVEIS PARA ESCRITORIO LTDA - EPP,2480,"aquisição do mobiliário para serem utilizados pela Saúde Mental - CAPS II e III, através da Secretaria Municipal de Saúde.",Secretaria Municipal de Saúde,"Qual o valor gasto com aquisição do mobiliário para serem utilizados pela Saúde Mental - CAPS II e III, através da Secretaria Municipal de Saúde.",MINAS CIDADES CONSULTORIA EM PATRIMONIO HIST E CULT LTDA EPP,25800,,,,Prefeitura Municipal de Uberlândia
26683 - 2014,13/07/2015,6 - PREGÃO ELETRÔNICO,861,CIRURGICA ZANIN LTDA - EPP,13000,"aquisição de materiais laboratoriais, em atendimento à Secretaria Municipal de Saúde.",Secretaria Municipal de Saúde,"Qual o valor gasto com aquisição de materiais laboratoriais, em atendimento à Secretaria Municipal de Saúde.",MINAS MAIS PRODUTOS ALIMENTICIOS E SERVICOS LTDA - EPP,3284781.6,,,,Prefeitura Municipal de Uberlândia
32773 - 2014,03/09/2015,6 - PREGÃO ELETRÔNICO,1075,COMERCIAL GRANADA MATERIAIS DE ESCRITORIO LTDA - EPP,3641.5,"aquisição de aparelhos diversos (quadro de aviso, telefones, relógio de parede e ventilador de coluna), em atendimento à Secretaria Municipal de Saúde.",Secretaria Municipal de Saúde,"Qual o valor gasto com aquisição de aparelhos diversos (quadro de aviso, telefones, relógio de parede e ventilador de coluna), em atendimento à Secretaria Municipal de Saúde.",MOISES HAMERSKI - EPP,14322.52,,,,Prefeitura Municipal de Uberlândia
28357 - 2014,12/05/2015,6 - PREGÃO ELETRÔNICO,934,ZAFALON SOLUCOES HOSPITALARES LTDA,50500,"aquisição de equipamentos hospitalares, em atendimento a Secretaria Municipal de Saúde.",Secretaria Municipal de Saúde,"Qual o valor gasto com aquisição de equipamentos hospitalares, em atendimento a Secretaria Municipal de Saúde.",MOURA EMPREENDIMENTOS COMERCIAIS LTDA - ME,124681.54,,,,Prefeitura Municipal de Uberlândia
10369 - 2015,13/07/2015,5 - PREGÃO PRESENCIAL,182,MAXICROM INDUSTRIA GRAFICA LTDA - EPP,5222,"prestação de serviços gráficos, em atendimento á Secretaria Municipal de Saúde.",Secretaria Municipal de Saúde,"Qual o valor gasto com prestação de serviços gráficos, em atendimento á Secretaria Municipal de Saúde.",MULTISEG UNIFORMES E EQUIPAMENTOS LTDA EPP,2124,,,,Prefeitura Municipal de Uberlândia
32773 - 2014,03/09/2015,6 - PREGÃO ELETRÔNICO,1075,EGIDE - COMERCIO DE VESTUARIO E ELETRODOMESTICOS LTDA - ME,511.88,"aquisição de aparelhos diversos (quadro de aviso, telefones, relógio de parede e ventilador de coluna), em atendimento à Secretaria Municipal de Saúde.",Secretaria Municipal de Saúde,"Qual o valor gasto com aquisição de aparelhos diversos (quadro de aviso, telefones, relógio de parede e ventilador de coluna), em atendimento à Secretaria Municipal de Saúde.",MWV WEBSITE COMERCIO DE PRODUTOS ELETROELETRONICOS LTDA - ME,17696,,,,Prefeitura Municipal de Uberlândia
18340 - 2015,15/12/2015,6 - PREGÃO ELETRÔNICO,386,PLANO A COMERCIO E SERVICOS LTDA - ME,8864,"aquisição de mobiliários (arquivo de aço, cadeira universitária, mesa tipo secretária e outros), em atendimento à Secretaria Municipal de Saúde.",Secretaria Municipal de Saúde,"Qual o valor gasto com aquisição de mobiliários (arquivo de aço, cadeira universitária, mesa tipo secretária e outros), em atendimento à Secretaria Municipal de Saúde.",NASCUCAR INDUSTRIA E COMERCIO LTDA - EPP,311623.23,,,,Prefeitura Municipal de Uberlândia
30639 - 2014,10/06/2015,6 - PREGÃO ELETRÔNICO,1015,LIFEMED IND DE EQUIP E ARTIGOS MEDICOS HOSPITALARES S A,86088,"aquisição de equipamentos hospitalares, em atendimento á Secretaria Municipal de Saúde.",Secretaria Municipal de Saúde,"Qual o valor gasto com aquisição de equipamentos hospitalares, em atendimento á Secretaria Municipal de Saúde.",NASMAN INDUSTRIA COMERCIO E CONSTRUCOES LTDA,1560775.07,,,,Prefeitura Municipal de Uberlândia
19878 - 2015,14/10/2015,5 - PREGÃO PRESENCIAL,445,OLDAIR AMADEU,3480,"contratação de professor para ministrar cursos e treinamento (aulas de Tai-chi-chuan), em atendimento à Secretaria Municipal de Saúde.",Secretaria Municipal de Saúde,"Qual o valor gasto com contratação de professor para ministrar cursos e treinamento (aulas de Tai-chi-chuan), em atendimento à Secretaria Municipal de Saúde.",NELIO PAULINO LINS PRODUTOS HOSPITALARES- ME,55000,,,,Prefeitura Municipal de Uberlândia
6556 - 2015,02/06/2015,6 - PREGÃO ELETRÔNICO,126,IMAGEM SISTEMAS MEDICOS LTDA,181900,"aquisição de equipamentos de informática (aparelho de anestesia e equipamento de raio x), em atendimento à Secretaria Municipal de Saúde.",Secretaria Municipal de Saúde,"Qual o valor gasto com aquisição de equipamentos de informática (aparelho de anestesia e equipamento de raio x), em atendimento à Secretaria Municipal de Saúde.",NEO OFTALMOLOGIA - NUCLEO ESPECIALIZADO EM OFTALMOLOGIA DE U,313040.24,,,,Prefeitura Municipal de Uberlândia
15091 - 2014,17/09/2015,6 - PREGÃO ELETRÔNICO,505,SHG COMERCIO E SERVICOS LTDA - ME,8579.17,"aquisição do mobiliário para serem utilizados pela Saúde Mental - CAPS II e III, através da Secretaria Municipal de Saúde.",Secretaria Municipal de Saúde,"Qual o valor gasto com aquisição do mobiliário para serem utilizados pela Saúde Mental - CAPS II e III, através da Secretaria Municipal de Saúde.",NOROESTE COMERCIAL DE SUPRIMENTOS LTDA - ME,106466.2,,,,Prefeitura Municipal de Uberlândia
8960 - 2015,23/10/2015,6 - PREGÃO ELETRÔNICO,166,MAAP COMERCIO DE MOVEIS PARA ESCRITORIO EIRELI-EPP,2994.5,"aquisição de materiais diversos (estante de aço, ventilador, mesa, armário, etc), em atendimento á Secretaria Municipal de Saúde.",Secretaria Municipal de Saúde,"Qual o valor gasto com aquisição de materiais diversos (estante de aço, ventilador, mesa, armário, etc), em atendimento á Secretaria Municipal de Saúde.",NOVO POMAR PRODUTOS ALIMENTICIOS LTDA,13095,,,,Prefeitura Municipal de Uberlândia
22018 - 2015,24/09/2015,1 - CONVITE,539,JORGE SOM SERVICOS & COMERCIO LTDA,14450,"locação de veículo tipo trio elétrico, com mão de obra de motorista, técnico de som, operador gerador e auxiliar de palco, em atendimento à Secretaria Municipal de Saúde.",Secretaria Municipal de Saúde,"Qual o valor gasto com locação de veículo tipo trio elétrico, com mão de obra de motorista, técnico de som, operador gerador e auxiliar de palco, em atendimento à Secretaria Municipal de Saúde.",NOVO SECULO MOVEIS PARA ESCRITORIO LTDA - EPP,109484.6,,,,Prefeitura Municipal de Uberlândia
